id,headline,body,image,link,emoji,created_at,repost,author
post:d6972147-d525-4679-a910-87510b969fd3,Perspiciatis triumphus curtus magnam sordeo cui pauper spiritus addo spargo.,"Audentia curia acsi vesco valens. Adficio sit inflammatio addo cubitum coniuratio vulariter claustrum sol solum. Accusantium curo acceptus adsuesco cogito vitium.
Esse utilis considero vir.",https://loremflickr.com/640/480?lock=3361949964304384,,🐄,2023-11-12T12:38:06.712Z,,user:0a081d17-f6ad-4bad-a8c9-2d2a8fd99d6b
repost:fa2dcd64-c259-4f1f-a284-2039719c300e,Nisi censura alo vitium carus.,,,,,2023-10-31T20:53:26.799Z,repost:de40ef55-99a4-4a36-ab85-422732bf5db2,user:f99080a0-221d-4b29-8947-873b80bc3b3d
repost:25de6a24-e4b6-4431-84a4-c9e905b560b5,Officia tergeo sequi casus adduco vereor bardus.,,,,,2023-10-29T10:20:40.590Z,repost:b2ff50e1-bbc1-495e-9b9f-cd11c7027053,user:a6b6c584-4362-4f76-9d53-bcc305894fe0
repost:32537f99-de6a-44ec-8f88-9d110d878de1,Conturbo concido summa angustus molestias surculus vomito subvenio beneficium tot.,,,,,2024-03-02T14:11:51.377Z,repost:b3bd33ca-ce35-442c-bbf6-6afd191a88d0,user:74ae777f-a23a-4cf7-9dfb-8e6855c7e62c
repost:533f7a2b-5c1a-4d71-a517-bdba6d2c383c,Villa thesaurus aggero.,,,,,2024-05-19T22:08:43.544Z,repost:758c86b4-6473-401f-a373-b465bfbdac6f,user:e44f4830-de46-4677-88ad-0be8bb8c3ff3
repost:1ae83688-2ab3-402a-93d8-c2313e9af079,Titulus summopere utor torrens.,,,,,2024-04-08T09:41:15.300Z,repost:922b684b-5337-46a8-a9ec-bfc23f4feb42,user:81a22185-6536-4be4-a431-e51d3bc17cfe
repost:7903be6f-9e2f-41b6-8f08-d388914c037b,Quo venia aggredior spiculum natus amplitudo utilis adeo deleo quia.,,,,,2024-03-08T18:20:04.504Z,repost:629fe29f-558d-4202-8c10-dc2bb9db87d1,user:9304b8c1-7cd0-47ed-801f-c05c550d43bd
post:1c6a1e23-948f-4f9a-aab3-26138734c511,Cohaero delectus capio defaeco copia decretum deserunt statim similique.,"Ars usque theca adversus vomer. Anser tener nesciunt dens tamisium congregatio.
Tui vae turba. Adeo demo ceno conqueror.",,,🥊,2024-02-25T16:30:26.579Z,,user:411ac596-2b88-49dc-a4b1-2587083bf1b9
post:f10f79a2-0064-4d87-980e-4b57c80d9489,Rerum adamo coniuratio calculus sustineo dolor solium adaugeo delibero.,"Cupio credo corrigo certe denuo deprecator. Texo adsidue arca tabgo tabella.
Adinventitias crustulum triumphus verus vomica architecto.",https://loremflickr.com/640/480?lock=7287151102263296,,👇,2024-07-01T04:23:04.347Z,,user:8de7b460-884f-4bef-a05f-b09def94307c
post:9955ed1f-8266-4798-a856-22f5fff90b91,Desidero tenus sumptus caveo conduco tener.,,,https://acceptable-repository.org/,⚒️,2024-03-07T11:21:03.015Z,,user:700e4f98-f84a-4d4f-b62e-ae14b37f13bd
repost:0c74fef5-96dc-455b-9fcf-2b69e86fa6c1,Vapulus porro suadeo spiritus.,,,,,2024-04-28T09:47:10.502Z,post:48c3b85c-b7f8-442d-8440-867bc2267625,user:250fa761-685e-4404-89e8-5b52fe4a118d
post:d7dac833-7c41-40fd-a8c9-36607d88ed55,Amet vereor caries.,,,,,2024-05-28T19:51:57.032Z,,user:dcb57509-1e32-4340-8f1d-db90af7d4e86
repost:dbc006c1-3a70-44ca-a244-8cb21a22658f,Suus in cariosus condico tergum arcus quia denuo delinquo crustulum.,,,,,2024-01-17T12:44:03.501Z,repost:de40ef55-99a4-4a36-ab85-422732bf5db2,user:341d1b8c-9333-4f2d-9e24-020a11665528
post:6e1474a5-797c-4722-b81b-4dcca0e6975a,Crastinus pecco constans comminor teres.,,,https://punctual-baggy.biz,💈,2024-03-30T01:12:34.209Z,,user:3be12eef-5eab-4a6f-9fd6-c967eb2dd0f5
repost:22e57af3-5bfc-4e2e-ab97-a1a450bef80c,Sed temptatio suadeo aspernatur aegrus.,,,,,2023-09-23T21:19:46.844Z,post:e7a24706-f519-4a0c-8e50-ac85a388944e,user:b8e89104-6799-4ee6-bcd5-33d88c3266dd
post:c3d55422-f262-466c-825e-9955216de9c2,Civitas uter suffragium avaritia praesentium defungo maxime benigne pecco occaecati.,"Voluptas cupio bonus cuppedia distinctio aggredior. Crinis fuga ter. Coniecto depromo censura cresco solus ad stipes utique apostolus vesco.
Caelestis creptio ager vulgivagus deserunt inventore utor fugiat volva charisma. Delicate succurro abutor adstringo deripio. Certus creator cinis.",https://loremflickr.com/640/480?lock=2732808032223232,,,2023-11-18T03:38:30.314Z,,user:20e7cd89-608e-4e95-902d-4e7712ec52ad
repost:ce0dd249-4ab7-422c-bf7e-f62bf280b9cf,Sponte impedit placeat audio ceno certe advoco verbera est.,,,,,2024-06-11T18:59:43.873Z,repost:52a22912-55a3-46d9-a764-5b963b6d6a57,user:3be12eef-5eab-4a6f-9fd6-c967eb2dd0f5
repost:60efd5ef-2933-4441-b595-e87c78a02ea5,Comptus usque carus speciosus.,,,,,2024-01-09T22:30:24.951Z,repost:4246e604-c47b-46b2-b73e-523e6d85e5bb,user:f45b6c0a-5a8a-42b1-864b-8a90ed55eb4b
repost:656869d9-b183-4588-acd6-adbb04bf04b0,Totidem articulus torqueo aqua sonitus clarus constans atrocitas.,,,,,2024-02-21T22:31:27.792Z,post:b8b39bc1-f066-4740-8d09-7f4bf97110d6,user:dcb57509-1e32-4340-8f1d-db90af7d4e86
repost:0778e92e-67fc-445b-8f78-ad793d78670c,Centum xiphias animadverto demo arx acceptus demo explicabo.,,,,,2024-01-15T02:08:13.324Z,repost:718a51b6-3b74-451b-84d1-bc5e66155722,user:de479821-e148-4834-877d-8261a2c1d71c
repost:35b88770-e1d8-4fb5-8446-b8ec310f53f2,Occaecati delibero avarus succurro color vis tenax minus coepi.,,,,,2023-10-08T00:28:44.971Z,post:0d87a89e-925a-4bc9-bc6d-ace35b0e30d1,user:9304b8c1-7cd0-47ed-801f-c05c550d43bd
repost:ef8c93f2-bdea-4fa6-a263-7f47bc0d3786,Temptatio ut aegre aequus aliqua conscendo omnis calcar adopto.,,,,,2024-02-14T06:13:17.451Z,repost:8e4b5821-24e9-49dd-a3cd-085392705e80,user:7bf85548-7ba3-4ce3-a953-527217ae455d
repost:a94a94e6-eeae-4038-881c-9adbd4087cdc,Barba bibo ago tonsor voluptas adiuvo clam.,,,,,2024-06-14T20:40:52.942Z,repost:e32c46cf-3bdb-41e7-8598-2fff666b5531,user:d5cf07ca-8586-4eea-b410-5a3df8d31793
repost:a0cba52a-e72e-458b-8295-c8ee813d6e89,Deporto territo urbanus conservo.,,,,,2023-10-14T20:16:15.003Z,repost:99c96c93-7f4f-4b77-88d1-d357bfc53517,user:4826b7db-800e-4aa7-adfb-784b16c86ac7
repost:3c753259-a69e-47b5-a9be-78d7f9a04a29,Ventosus sperno enim ademptio utrum correptius comedo vigor.,,,,,2024-01-27T09:26:31.010Z,repost:c95fc995-c32b-4b1a-b9bb-b0c677f03b26,user:9eefbc81-12f1-42b8-b529-0a9428a5b92e
repost:f8b41b20-8064-4241-96fa-3ca0a18a83fb,Curso cado corpus vulgivagus tondeo tamisium amo ante dedico balbus.,,,,,2024-06-02T14:19:59.564Z,repost:38a40a89-555b-4d03-b59d-c9102478c0e5,user:3119fde2-38d6-4605-a947-c69fb191a1ec
post:7b9431bb-b3c9-46d2-afcf-e0a7c6ac7c38,Cogo comes confugo totus ars viridis vobis calamitas tertius.,"Constans dolorem usus virga. Utor blanditiis trucido utpote usque calculus.
Corroboro comparo coepi creator carpo complectus textor triduana timidus conatus.",,,,2024-03-23T09:12:40.037Z,,user:ab8b47e9-41e0-4a12-bfa3-8744b8ccbbfe
post:0969a7e1-aaaf-431e-96ef-f504a84c5cc1,Vos testimonium ipsam spargo solvo vae ut aspicio vulgus contego.,"Aperiam viriliter charisma denique corrumpo. Arbustum tumultus tergum ad eos. Conspergo vindico ago dolorem audacia.
Uredo asperiores armarium expedita auditor succedo corporis demum volo. Voluntarius advoco fuga provident vulnero. Varietas condico doloremque copia.",,https://quarterly-cash.biz/,,2024-05-14T20:30:12.693Z,,user:acba9a2a-a6d7-486b-a453-351a047281ea
repost:d6ebecab-5607-4b6c-b5d7-1640572252e4,Comparo aeger statim illo utique carmen thesaurus astrum tergo casso.,,,,,2024-06-18T06:01:53.687Z,repost:3a343511-df53-443a-88a7-8314049fec20,user:39a2f3f6-68b8-4e8a-8f01-42ed7d579943
repost:e10a431a-024c-47f9-912a-f062fb30274f,Totidem taedium spargo aufero degero.,,,,,2024-08-07T14:26:19.276Z,repost:2b22a84c-1fc3-4155-80db-e63a88580ffc,user:f13635b2-e6fd-4315-8af6-8f1f9da4ba1c
post:b3be658f-7731-4f5a-818c-965b03b19d79,Ventito consectetur cotidie dignissimos ter aro esse cotidie.,,,,,2023-12-22T13:47:47.695Z,,user:fc69accb-9664-47e1-96c7-b8c69189a689
post:3a204acf-c51c-4ecf-aea6-d14519599e41,Laborum doloremque utilis aptus quos.,,,,,2023-09-23T06:13:10.452Z,,user:1c79a862-839a-458c-9870-cd657f774899
repost:fa31a44b-2688-4dd8-8dca-2eb05ce73fcf,Adhaero demulceo audio creo non subito armarium voluptate.,,,,,2024-08-08T06:52:24.815Z,repost:0778e92e-67fc-445b-8f78-ad793d78670c,user:9a1beada-6f47-4b2f-aec4-8aa2c1881d20
repost:e7519757-7ae5-48d9-adfe-3b0c291d8a98,Cetera vere colo color neque reiciendis catena contego termes stipes.,,,,,2023-09-24T21:47:02.506Z,post:9955ed1f-8266-4798-a856-22f5fff90b91,user:e291f927-64d4-47e8-9a89-89e27abb7aa5
post:19198bd0-b174-401d-8740-d1766149c777,Spectaculum turba perferendis attollo.,,,https://lopsided-ironclad.net,,2024-06-15T18:34:25.704Z,,user:6621116e-c933-46ca-8bdd-7ca437bafe06
post:df7d0777-413c-4df1-a295-b12bccb07631,Vinum aperiam cribro.,"Ventosus concido timidus placeat.
Tunc curso nisi voro abundans. Nobis caput voluptates sub despecto cubicularis cariosus. Tero aliquam custodia deinde claudeo.",,,,2023-11-14T03:43:46.677Z,,user:6cad3c1c-a719-46bb-88d8-fd670ac52adf
repost:99d0a943-d45c-416a-a69d-d943e840087c,Caste ustulo vulgus vulgivagus umerus speculum.,,,,,2024-08-13T06:18:15.229Z,repost:8cebb18b-6203-4390-9ed8-b3e21a92afc1,user:dcb57509-1e32-4340-8f1d-db90af7d4e86
repost:1b4391e0-307e-48f8-924e-4b514d36567d,Verbum maxime vulpes sursum cibo curtus absum ut.,,,,,2024-04-17T05:39:10.160Z,repost:2d060dec-80de-4683-8a41-6ba29d7fab63,user:37faa4ee-aea6-4cae-af6a-32b71a93e1fe
repost:750ea2a6-f066-41a9-9ec3-3d392dd444ac,Ulterius tubineus laboriosam vitae verbera cupiditas adamo.,,,,,2023-09-02T07:47:16.821Z,post:c8985eea-1fe4-4412-9aaa-62c11d730a13,user:a55df2a6-2bfe-4717-b7ce-f2e641e1111d
repost:43431545-5daf-41c1-8c7d-fb78716f2348,Triumphus crinis deorsum.,,,,,2024-02-24T05:22:08.732Z,post:3a204acf-c51c-4ecf-aea6-d14519599e41,user:5906cf07-397a-4d42-b993-c952a5918aad
repost:ab0796f5-00f6-4318-94f2-b8765d8413df,Cotidie volup error vicissitudo enim conduco ago.,,,,,2023-10-26T23:21:22.773Z,repost:5305c36b-5186-4a98-a4d0-6b8481be6440,user:73aa00b3-03de-419c-9021-4988fac19d67
post:596398ec-a003-43ce-9873-e32df141b842,Sequi tui ventus denuncio thesis utor blandior.,"Viduo sulum amiculum auctus. Demens civitas umerus.
Ducimus stultus tutamen degenero statim. Studio aestas adipisci suffragium.",,,🏑,2023-09-24T23:16:18.968Z,,user:3550c9d0-47c3-42f5-b294-da35064e074b
repost:14ebefa8-1017-4b74-bde8-6430238c4ee3,Cresco decor usitas defluo culpa caveo.,,,,,2024-02-25T07:11:25.611Z,repost:f8a0ae53-f81c-4854-8bd2-90f840054e74,user:c8cbc916-d4f0-4d9e-b0c9-6611f3a797b6
repost:889757ad-b900-4a5b-895d-e606d0168e23,Adduco commemoro cariosus tempus corpus torrens talus.,,,,,2024-01-14T22:13:15.135Z,repost:b126c1ea-5a75-462c-83a7-e73fafb9a93a,user:76742fac-803a-4fe4-88ae-3c2a03d6aba6
repost:5e2f318f-c8f0-4dce-88db-59fad871a985,Suppellex qui ceno calcar.,,,,,2023-09-04T20:11:27.413Z,repost:13f82cca-2069-49c2-a820-c207c1433bba,user:bca04c77-9b4c-4990-a0ee-160cc2bdc4d0
repost:770514b3-2383-4f89-81d5-c737ffb6ba4a,Cruentus conicio spiculum brevis neque tempus.,,,,,2023-09-15T08:21:11.883Z,post:9ff62582-c200-4c2c-a270-3bb58245ffaf,user:88e8edeb-11de-4bf6-806e-13a74642672a
repost:36f37a69-2157-4780-9143-6fb1c3d4d819,Magnam alias decimus minus torqueo depulso enim vetus.,,,,,2024-01-08T13:49:17.112Z,repost:95f2ea0e-57e1-48ae-b835-eccbf8a4da5c,user:dd47e9d9-ef67-4643-ab7c-9259b8a8470a
repost:f6717ba6-b9e9-4589-95f9-d72439f9a920,Tyrannus decens ambitus decerno cultura degero solitudo.,,,,,2024-05-20T20:30:07.397Z,post:21024ccc-4f8f-4be8-82be-e272518dabbb,user:bbe0ea5e-4163-4f80-81b1-beb732cbe786
repost:7bec23d9-4e6f-434b-a29d-220969ba171c,Ulciscor utor ipsa vulariter commodo.,,,,,2023-09-02T01:30:50.603Z,post:1c6a1e23-948f-4f9a-aab3-26138734c511,user:4a4b6ce7-344f-4f9f-9e77-62892677b191
repost:e4028a84-05a8-45a1-ad08-0fc17f689a25,Speciosus totam demergo abbas taceo cinis degenero viduo.,,,,,2024-08-06T20:00:47.038Z,repost:bb2eb3b3-3083-4c19-825f-87f9946489d8,user:3bdfe7dd-9a57-498d-a24e-fe2ed3c789ca
post:55b3a1ea-1b2e-4e14-9cc2-56c26c126d72,Caveo compono corrumpo auditor pariatur demitto.,,,,🌌,2024-02-04T10:00:44.695Z,,user:475e602b-fdea-4db3-9469-7c5fc0086eba
post:0c899370-8318-476d-875a-4d7a2d68cd85,Vulpes crapula uxor.,,,https://concrete-dud.name/,🎿,2023-09-29T13:05:21.293Z,,user:f6e9b6a1-feae-4e63-a021-d075acef5cad
repost:ba49d27e-8c07-4e37-b3fb-9c270ff2803e,Accusantium molestiae ulciscor aperiam vulnero alioqui defero truculenter.,,,,,2024-02-23T05:33:11.111Z,repost:7e7c05b5-4464-47df-bc90-66a57dadf8d6,user:d5cf07ca-8586-4eea-b410-5a3df8d31793
repost:405788e0-8774-4eb7-808f-28a07fb88231,Dapifer crebro magni fugiat tibi statua casso capitulus speciosus ademptio.,,,,,2024-01-24T20:21:59.411Z,repost:13883e1d-6579-45c6-a619-aed0073db784,user:2af5ad94-5c20-486f-a434-bbcac84075de
post:2761435a-8a37-4195-8d3b-0d39561d1a98,Sollicito aranea sponte canonicus video.,"Dens dedico in. Tamisium universe vivo earum cruentus viduo celebrer abundans voveo. Decipio architecto vito curatio adnuo viridis.
Umquam deporto defaeco cruciamentum synagoga degusto beatus creo patrocinor.",,,🦶,2024-04-10T02:57:48.699Z,,user:99677da3-dd44-4ebc-8bed-fdf1d243334d
post:f1e9d13b-66fb-4367-92a7-20ebf2cab133,Ago ager nemo brevis.,,https://loremflickr.com/640/480?lock=5647831209607168,,,2023-09-09T04:51:44.573Z,,user:4ed9b19f-4da2-42e1-916c-1db3781828a4
repost:5e858778-56ee-488b-ac7c-4a66d9cfeaa0,Arma antepono solium versus amitto tersus.,,,,,2024-07-18T15:24:35.872Z,repost:efdd5a74-8a83-4b47-a872-2a812eaaff23,user:d5cf07ca-8586-4eea-b410-5a3df8d31793
repost:4a8108aa-b75e-42c6-8c5d-37470fa5066d,Alveus acidus adicio venio.,,,,,2024-05-12T23:02:52.169Z,post:7d1f91c9-b16d-4864-9305-e19e32e12660,user:bcc39bc1-52af-4029-9798-489170872aed
repost:ea42f923-84cf-4072-84ee-3a1dc511c3a6,Cena tui ad audio solutio tredecim aqua adeo defungo.,,,,,2024-01-30T01:14:11.098Z,post:b8b39bc1-f066-4740-8d09-7f4bf97110d6,user:68f3d146-d296-46a8-84c6-716f25397c7b
repost:6cab920c-2965-4244-aaae-0b93f3d3db62,Teneo arceo eos caries.,,,,,2023-11-14T15:29:25.161Z,repost:e32c46cf-3bdb-41e7-8598-2fff666b5531,user:0e1b88f2-e06c-413b-aa68-efb1f9f22954
repost:e7d16ba0-d5de-4f97-9dae-91a63d51d8f2,Bardus nam peior alienus cur.,,,,,2023-08-30T14:37:39.893Z,repost:80ee8dc7-3d9c-48d5-8a37-ad14aac8cde0,user:672e6ce5-008f-4f45-a036-56b560a677ba
post:cf49bb60-7a36-4080-a7c3-fe929a85ed3c,Denuo quaerat socius ager ascisco.,"Arbustum trado ager temptatio bis stillicidium. Conor adopto astrum charisma. Cura coniecto spes.
Vilicus voluptatum derelinquo substantia.",,https://tinted-comfort.biz/,🐚,2024-05-16T00:19:50.043Z,,user:4186ef71-1759-43a8-947a-a0191728a726
post:30e5a52b-3eda-408e-b904-14fbf38387d2,Solum ex tempora talis tredecim inflammatio.,"Acceptus thorax cavus. Tam cunctatio uredo ars ante.
Desolo anser quam sumo.",,,🥩,2024-02-29T00:07:55.376Z,,user:9e64b9ac-52d3-49ce-9b8b-41f6be0e67ed
repost:3b981a1c-25f9-420d-bd0d-a7e364b1ba46,Bestia caries super.,,,,,2024-03-28T22:24:32.644Z,post:a3171855-1b6a-453a-8935-9c61af03eb4a,user:6cad3c1c-a719-46bb-88d8-fd670ac52adf
post:5f9fdb32-6fa5-4f8a-9d38-33d21446ba05,Blandior vaco solus.,"Pariatur auxilium commemoro audax rem. Ipsum dignissimos crinis auctus coepi colo eos communis aveho cervus. Somniculosus rem sollers aureus claustrum amicitia tracto deficio vicissitudo.
Velut et vinculum tersus aequitas veritas sub patior talus urbanus. Uterque denuo patruus administratio desipio statim. Taedium torrens cerno.",,https://poised-apartment.net,,2024-01-18T09:22:20.238Z,,user:3ced374d-9745-4303-8ca7-45c19f8f25e4
repost:98bd91ee-73e5-4c5c-afa9-8dcd9dcb288f,Tum viridis vir talio subnecto combibo maiores soluta balbus accommodo.,,,,,2024-01-29T11:10:46.273Z,post:1e10a0b4-8990-44cd-ada4-bc05b80cb8a7,user:74ae777f-a23a-4cf7-9dfb-8e6855c7e62c
post:493ff3ec-4803-406e-8c96-241c10408ac9,Cruciamentum thesaurus autus aliquam conor.,"Tutamen aeneus attero commodi argentum vorax dolorem. Abduco porro arcus. Suppono atqui advoco dedico terebro.
Adicio veniam pauci tantillus. Esse veritatis comburo vigor.",https://loremflickr.com/640/480?lock=1813034982965248,,😬,2024-08-17T09:44:15.767Z,,user:e6d7e5db-bf74-426c-a7ea-93db6cdd8c8e
repost:5c4062a3-05e7-4529-b5be-f5e2b7966120,Vos claudeo absque crepusculum uxor defetiscor triumphus asporto cado sollers.,,,,,2024-01-13T20:30:27.507Z,repost:8a5902ea-b07f-4cec-8008-85ab08376ffc,user:895cc69c-50d7-413d-900a-01babcafcf5c
repost:3dde3e7e-da3a-4fbf-8461-4a501e18e84c,Decerno saepe usus.,,,,,2024-05-15T03:40:10.190Z,post:4a6fc284-9745-4587-bbb7-5143d49a9584,user:09921475-d286-4bb4-b46b-25100b0d9f42
repost:a5a5ef96-e9b7-45d8-a868-b92385d28ba9,Apostolus damnatio aureus subvenio veritatis urbanus volva statua triumphus aperte.,,,,,2024-07-24T13:51:21.041Z,post:ab45d4fa-8e1e-44b8-8cf8-d5738bab3726,user:8d8373db-4fc4-4382-8308-f62eae2a7970
repost:d8f9c1b2-7819-4358-ab7e-80c4d9478cd3,Tenetur candidus suscipit vesica.,,,,,2024-02-27T14:11:59.339Z,repost:0479f3cf-0989-4682-a148-41124c5f31d3,user:c75b7477-a4fb-43f9-8dd4-5cec897d6503
post:7bc1b6cb-341d-4d87-b1de-09b157dc1499,Articulus tripudio coma appositus auctus cohaero.,,,,,2023-12-03T21:40:17.425Z,,user:ab8b47e9-41e0-4a12-bfa3-8744b8ccbbfe
post:fabe2e14-7ffa-44f2-b747-0186745d4420,Abscido capillus surculus angustus.,"Cum creo templum veritatis ter creator necessitatibus auditor denego defluo. Complectus cribro sordeo defluo. Aeternus tonsor vapulus utique.
Comminor cognomen amo tibi umquam thermae succedo talio atqui textor. Circumvenio validus tibi sui aiunt.",https://loremflickr.com/640/480?lock=3196284798238720,,🇲🇹,2023-12-07T00:03:51.406Z,,user:7bd66ff6-cde2-487b-9a7a-f2d8c6ce7e9b
repost:9a4c5c11-74cc-4804-b066-992467d86a90,Attonbitus aliqua despecto vito suscipit conforto.,,,,,2024-03-31T17:02:20.480Z,repost:0e1d20b5-7925-4a2b-ae9b-f798caf06a17,user:fa2e3b53-77ad-4ca9-958c-86f4b43b06cd
repost:01616e9f-cc51-4a76-b33b-19cf7abe04fb,Ducimus tracto dolorum defluo adipiscor decimus temporibus.,,,,,2024-02-15T02:37:30.361Z,repost:e02b4b50-8c5c-46ea-b609-0961382186a0,user:4ed9b19f-4da2-42e1-916c-1db3781828a4
post:e374c01e-72e1-46e8-be85-f03ba8e24996,Taceo depulso curso ceno.,,,,🍊,2024-03-01T01:46:41.685Z,,user:75e56396-b472-4e58-90b1-bba4e3510e42
repost:492cfdf7-1e4c-403d-af8b-f5cfeb27eabf,Tribuo utilis altus ut quae.,,,,,2024-08-01T18:25:03.047Z,repost:82558c46-75b5-43f2-ac26-24b938e90a89,user:341d1b8c-9333-4f2d-9e24-020a11665528
repost:7ebe4c88-6392-4337-91c1-e9760cf1f541,Confero videlicet spiritus confugo adaugeo.,,,,,2024-01-28T19:22:49.502Z,repost:76b35ef9-d2e2-4044-a09d-150aecbbdcfa,user:a19a961c-c76a-4b0c-b78c-0b4f401018d1
repost:65ad5f55-89c2-4a47-999f-04753b78be4e,Sub corrupti deinde temeritas theologus amissio.,,,,,2023-08-27T01:52:09.084Z,repost:85fbc402-553d-4d13-8b50-5f8a54c0dd0f,user:4ed9b19f-4da2-42e1-916c-1db3781828a4
repost:c577ad93-847d-4f59-b3ca-b94d2a32ea2a,Unde adflicto comis veritatis.,,,,,2023-12-23T18:45:58.640Z,repost:3a343511-df53-443a-88a7-8314049fec20,user:348d6d86-30b0-4649-9905-039ae678839e
repost:8f8d1ceb-44c8-4244-9372-6c248e9802b8,Voluptatum vesper depromo caterva stipes fuga cupressus bis auxilium basium.,,,,,2023-10-25T03:25:18.204Z,repost:492cfdf7-1e4c-403d-af8b-f5cfeb27eabf,user:0a081d17-f6ad-4bad-a8c9-2d2a8fd99d6b
repost:ad723f4d-415f-4e2b-b746-cca04f201c46,Ipsa defaeco votum speciosus depereo.,,,,,2024-05-27T08:48:19.275Z,repost:f8b41b20-8064-4241-96fa-3ca0a18a83fb,user:775941cb-d920-46a2-b12f-86d1c89f38f1
post:0683e6d8-56af-46c0-8b82-3d2a30c812b2,Complectus decimus maxime.,,,https://ignorant-music-box.name,,2023-10-17T19:56:53.449Z,,user:5a482623-fa9c-40a2-9205-fb87944cee90
repost:9f168802-c2a1-4ec4-92c6-ac711e82b9b0,Vindico volo tolero consuasor tot aut comitatus demulceo.,,,,,2024-01-11T13:21:23.503Z,post:8a83e12c-b785-4e86-8fa2-f882f205ae8f,user:7a4a022a-c2c6-4da3-94c9-399e1c8ae655
repost:269a21f2-5685-4971-9bf7-0804a3ae175a,Sunt solus amicitia.,,,,,2024-05-17T13:31:57.989Z,repost:405788e0-8774-4eb7-808f-28a07fb88231,user:96501074-22f7-4979-ba91-665acae1419c
post:c514a99d-1d82-4197-a46d-87315bfdcccc,Quasi utrum comburo.,,,,,2024-06-04T18:27:27.508Z,,user:411ac596-2b88-49dc-a4b1-2587083bf1b9
repost:56114e3e-c38d-4c1e-aea0-a574727e2acc,Vos tenetur demitto libero trado abeo sui pecco constans agnosco.,,,,,2023-09-12T17:33:51.084Z,repost:6aa46ec4-5f30-429d-b6fb-2f35a87e1b4c,user:baefdf08-4f9e-4f1b-b1f4-b72559ed8c64
repost:c82de6e3-bed4-4082-9e87-b066bf254498,Capitulus advenio caste argentum causa porro speculum amo creta sol.,,,,,2024-02-14T21:26:05.106Z,post:df7d0777-413c-4df1-a295-b12bccb07631,user:d5d73454-7f37-4b07-9af0-c00dca57aca6
repost:63e87ba7-e756-4593-84ff-f2f8b5fd6283,Capio avarus accommodo tum sollers.,,,,,2023-11-21T01:51:03.609Z,post:7b2e57b1-91a5-4c33-92ae-1179a5f77f9c,user:e9f4cec6-2c26-4df8-93c4-beec493cb88a
post:fb5a6db3-e173-404f-8d92-2e7de4f899e0,Claudeo viduo degenero absque caput tenuis conitor socius neque terebro.,"Amplexus tendo argumentum fugiat utroque solus quidem abstergo undique rerum.
Altus crastinus aegrotatio audacia vinculum peccatus. Quisquam speciosus curso bis est. Crapula volubilis umquam cena spero blanditiis.",,,,2023-08-25T23:44:27.658Z,,user:bda76fa7-0723-4133-a4bc-7771fd61006c
repost:591a016c-4eb6-447b-bcee-1e6ae3f7162a,Tondeo degenero terga strues autus depromo vulgivagus acquiro velum.,,,,,2023-08-27T19:18:20.797Z,post:64394b4e-4c1b-46d5-8aa3-e0640eead076,user:bbe0ea5e-4163-4f80-81b1-beb732cbe786
repost:23066ae6-9481-44a5-a925-b5d8601caf28,Ceno conqueror argentum deprimo blanditiis utor doloribus tardus tolero ambulo.,,,,,2023-10-27T20:20:42.796Z,repost:591a016c-4eb6-447b-bcee-1e6ae3f7162a,user:85625e6d-c20a-479e-9787-b52d1810f311
repost:42e4ff96-9612-4ad0-a112-707d80cababb,Urbs triduana apparatus.,,,,,2023-11-11T10:38:17.104Z,repost:7dfbf88a-b544-46b2-ae47-ccf65c65a5c9,user:efe41fc2-c375-40f9-a96c-df80ff667c7a
repost:c0689dc5-9d7c-4c18-8d9f-1725ea35059b,Tabella summa caelum universe timor.,,,,,2023-09-22T01:25:35.835Z,repost:922b684b-5337-46a8-a9ec-bfc23f4feb42,user:a962f856-ee18-4228-bbb5-2347fe86229d
repost:c9559ca1-3af3-48f8-b587-1cca1b30bb23,Patrocinor vere depono accommodo videlicet carus.,,,,,2024-06-27T09:25:25.764Z,repost:0ac41e9b-de39-4c17-b41c-bb2bd1ea68d5,user:76742fac-803a-4fe4-88ae-3c2a03d6aba6
repost:7b87bfec-7588-4b01-94c3-9e0beb66a7f0,Umbra adflicto quaerat trado vinco collum derelinquo stipes alienus.,,,,,2024-03-28T14:49:38.319Z,repost:d06f4f63-7885-4ec8-8f41-44b6aee1107f,user:6f768309-58ef-495b-b484-bf720334c452
repost:f94e8c26-58e2-4470-a0d3-ee313ca6db17,Acceptus delectus sortitus autem velociter strues caput excepturi brevis.,,,,,2024-01-06T16:43:00.226Z,post:c51249ee-ad8f-4db4-a39b-883dc6c4ddac,user:1c79a862-839a-458c-9870-cd657f774899
repost:70477f95-cb0b-473f-a960-c731240c491f,Amoveo ars audeo ustilo credo nulla.,,,,,2023-11-04T19:10:09.241Z,post:0abdd0e3-93cc-4553-8d0a-ee04e0679f56,user:3466f4ce-2dd7-491e-a54a-5d4b7a942ac8
repost:b9bba7c5-8f4b-4c5a-b9e2-edfa20938e11,Demum repellendus vilitas.,,,,,2024-02-03T18:57:43.110Z,repost:1b012680-f299-4977-87fd-96fe75f45018,user:9a1beada-6f47-4b2f-aec4-8aa2c1881d20
post:a61cfdb3-2ea5-44d4-b1b7-a1ba928509b6,Cunctatio supplanto degusto bellum conculco depono ventosus dolores.,"Eaque temperantia deprimo sub.
Coma conitor traho aer bos terminatio temperantia sequi artificiose. Exercitationem cernuus bardus defetiscor adflicto.",,,👊,2024-02-27T22:42:25.983Z,,user:aa54cd82-7fc9-4dae-9ed6-6d36c3829d21
post:e4aed675-4602-4cd7-8a9e-347f7ce8cf0d,Condico timor dicta titulus tandem adfectus.,"Viridis comburo corpus comedo apto damnatio accusamus trans esse. Commodo cresco sol cursim sophismata necessitatibus. Utrimque aperio peior despecto tempora alter.
Ventus audentia avarus vinculum vereor vergo verto. Acquiro avarus cedo eaque voluptatum tibi benigne stella. Virtus adopto nisi.",,https://ready-material.name/,🍉,2024-01-20T14:20:09.625Z,,user:bca04c77-9b4c-4990-a0ee-160cc2bdc4d0
repost:9f917149-0d94-4e74-b4fe-96dea4eb9f25,Doloremque ut desipio corrupti coepi tristis vesco.,,,,,2023-11-06T07:45:55.151Z,post:8863d2de-04f9-48e8-a68c-41eed695a41f,user:5906cf07-397a-4d42-b993-c952a5918aad
repost:d9444823-6a41-4d1d-94ba-00ac2659a1a8,Cogito victoria aggero tergeo volva addo tepidus carpo depono.,,,,,2024-04-24T11:35:51.912Z,repost:4f12e9ae-dc4d-4ca9-bf8d-eace58451a06,user:7191e034-c822-4350-9ee6-58c21c949306
post:7a475936-fc63-4163-bf01-3a267a8096cd,Caelestis commodo aeneus curto.,"Ventosus vestigium cenaculum. Quasi consequatur stultus vereor. Arto adinventitias tripudio.
Crustulum concido volubilis clibanus turbo. Vicinus terga id dolore labore.",,,,2024-02-15T17:57:27.275Z,,user:d62c88a2-a93a-48df-a5b9-15de7ce3e659
repost:5502215c-f394-4ab5-8e08-6b6f59e81dbe,Tamisium tricesimus usitas quibusdam tamdiu volo argentum solvo textor crur.,,,,,2024-01-17T23:33:19.407Z,repost:eb35f90d-2a33-416c-9fd6-97438a7aeb86,user:2cd09070-963c-4fba-a1dd-9ae0c43f69db
repost:472f6e0f-97dd-41b9-a72a-0c806322cc01,Adstringo terror reiciendis ad complectus unus auxilium cunctatio videlicet.,,,,,2023-12-24T04:32:03.941Z,repost:d16a0aa0-1cda-4321-9768-5ece32ebd385,user:847aef53-8e28-448a-8857-4f1fbb1e1d8e
post:c96f6237-e470-44da-86d3-ce5f16b1ce03,Degenero denique comprehendo ipsum apud textilis.,"Aliquam demoror vociferor tero demoror conitor atavus quia concedo. Demulceo tui decor veritatis repellendus arceo.
Averto dicta ustilo nobis truculenter arbor pariatur quidem.",,,,2024-02-06T17:46:43.675Z,,user:6071522d-c31f-478a-b938-8439a34c3569
post:6c1c85ed-734b-4c36-829c-a666c85a2453,Beneficium abstergo audax aureus aestus.,"Depono mollitia truculenter cohors curo deleo dedecor.
Aegrotatio vallum paens considero.",https://loremflickr.com/640/480?lock=4019711794741248,,,2024-07-11T00:33:36.209Z,,user:a962f856-ee18-4228-bbb5-2347fe86229d
repost:ec5cf7bf-4ef0-42cd-818c-190291604798,Accusamus claro soleo verto quaerat defungo vobis cattus.,,,,,2024-02-12T03:08:21.572Z,post:47876115-9e76-44e4-bcc5-709b47d82228,user:12b79968-08fe-407b-bd80-96eff40b58b8
repost:135f5ea0-5dbc-4a24-81f6-668069ff9e8b,Ciminatio stipes amet succurro decretum vos suscipio.,,,,,2024-07-29T13:55:02.005Z,repost:965af489-ff18-4285-bcf7-c4c0c0930a32,user:dc547983-d39d-45c7-ae9c-b407e7711c85
