id,headline,body,image,link,emoji,created_at,repost,author
post:9bdd8069-09a0-460c-a298-af07261019a4,Quos subvenio sulum benigne aeneus optio termes.,"Sol aggero coma arguo.
Repudiandae versus crapula curiositas beatus tenax sufficio. Denique ipsum carbo. Verus delectus attonbitus ut ipsum aestivus degero doloribus audax occaecati.",,,,2023-10-26T22:58:30.849Z,,user:ee8aaddb-01fd-4cdf-b805-458636837364
repost:b956a483-afba-4362-8d19-758859b9cc3a,Quis vereor sto aurum amplus vae casus aliquid tui tibi.,,,,,2024-05-20T03:46:53.257Z,repost:57f5a11b-50fe-4605-a46c-531f27bae4d2,user:484858f8-1fa5-4d9b-a760-11e3914a5ee6
post:ab45d4fa-8e1e-44b8-8cf8-d5738bab3726,Voluptatum modi vitiosus optio aegrotatio curatio vivo cura curso.,,,,,2023-11-10T10:36:16.004Z,,user:620055e9-f243-47a9-b7fa-1788ce31dbf4
repost:b53fd517-a447-414e-b9c8-4b2f1f395a25,Adeo super arbustum neque sui conqueror curis tabesco venustas vinitor.,,,,,2024-04-01T10:54:19.583Z,repost:37fd77ae-3728-4808-8651-849d6d25de18,user:603b18cc-48ef-46cc-beba-30ebdb000dd4
repost:3a343511-df53-443a-88a7-8314049fec20,Cenaculum debeo calculus asporto cognomen adsuesco tribuo vere adhaero agnosco.,,,,,2024-01-15T18:12:21.640Z,repost:6220f0bf-53ed-4627-a0be-f5eb04130140,user:07e25c21-ba20-43a2-8eb2-ac6c520ceacd
repost:c5da3cc6-7250-452f-9cc1-161fe71d590d,Optio quos amor subiungo sol fugiat cognatus supellex victoria.,,,,,2024-01-29T19:53:56.778Z,post:128a6636-30ec-4fe7-8836-c4630bb0fb81,user:4a8ffb80-32a1-4232-8067-01b57c466871
repost:ef264961-11d2-45a8-81f9-a233bd4e587b,Capto vinculum pecus ambulo corporis dolorum tot careo comes.,,,,,2023-12-13T04:56:07.234Z,repost:65552a44-f740-459c-930d-a00cc26ebd84,user:a962f856-ee18-4228-bbb5-2347fe86229d
repost:fa4f8290-1969-4c0a-9e01-56855e2f72a5,Tolero earum combibo ver cerno tantillus crux condico creator color.,,,,,2023-10-10T22:07:56.923Z,repost:3cf5292e-7c7c-4fff-ba01-c7ab3ad20a39,user:fc9f89f8-c018-46d5-9b7b-f86698d91c14
repost:c06b3139-5350-4c30-8685-a4cec10b0481,Valetudo talio defessus absque tremo speculum.,,,,,2024-06-07T22:51:34.214Z,repost:2b22a84c-1fc3-4155-80db-e63a88580ffc,user:3bdfe7dd-9a57-498d-a24e-fe2ed3c789ca
post:c3dca92a-a2d0-456e-a608-d69b9d167f18,Ubi et patrocinor curia blanditiis vorago arca cultellus viriliter volup.,,https://loremflickr.com/640/480?lock=4571287229825024,,🍑,2023-10-17T08:44:03.061Z,,user:7bd66ff6-cde2-487b-9a7a-f2d8c6ce7e9b
repost:949490be-425e-4f03-b546-ab7aa296a519,Veniam summisse absens.,,,,,2024-05-02T21:12:22.472Z,post:ab45d4fa-8e1e-44b8-8cf8-d5738bab3726,user:4bb722af-4b6d-4417-a85c-f5bba299a69a
repost:85fbc402-553d-4d13-8b50-5f8a54c0dd0f,Varius amitto totus.,,,,,2024-07-30T09:39:33.888Z,repost:06c15a7b-1cea-4eae-9a14-832c70040e90,user:e4f3646b-519d-4314-b584-a79d1b39340c
repost:6b47df2c-78a7-4a92-9df0-b134e10cf80f,Tero exercitationem iusto.,,,,,2024-04-19T15:04:22.866Z,repost:2759fed1-c1d3-42cf-9773-c0f2cddd8217,user:1a1ba939-cae6-44ed-bd11-1a786e3ec32d
repost:facbcead-264b-48ba-b91c-831be897c543,Conservo deserunt cubicularis doloremque ustilo sordeo.,,,,,2024-01-11T14:25:47.952Z,repost:4f8f47b7-b5ec-4803-aed2-6fdf074360ed,user:96501074-22f7-4979-ba91-665acae1419c
repost:353a9e3c-917f-428c-9302-427654a2f1df,Ars celebrer vulgo iste alius ullam.,,,,,2024-06-08T12:16:14.750Z,post:9bdd8069-09a0-460c-a298-af07261019a4,user:3a688105-8d26-4771-8250-f5f3d19faa1b
repost:4a6fb61c-bda0-4f40-9b53-76e3d74c4bb2,Assumenda cedo bene.,,,,,2023-12-12T01:37:25.618Z,repost:0dc41fd0-8e83-41a6-ba13-994ec703bc71,user:3f7756c7-694e-4e1e-9440-8499c1d1e0f7
post:d91a2733-76f4-490c-b190-fd5a140d972f,Umquam theatrum studio umerus amita patruus deleo adeo aufero.,,,https://tall-republican.name/,🤏🏾,2024-08-06T04:29:04.227Z,,user:3fcd0a7a-e9b4-47e0-81a3-5ce02ca6f56d
repost:963ce2f9-53e9-4489-909a-99fe392a81a7,Abutor taceo valde.,,,,,2023-08-31T19:53:01.981Z,repost:f56e6bf4-851b-429a-a0bb-33ba99608ffa,user:20e7cd89-608e-4e95-902d-4e7712ec52ad
repost:404f6137-b334-4d3b-a9d5-285f191301db,Ventito argumentum ipsa texo arma argentum adulatio basium ad umquam.,,,,,2023-10-11T18:36:28.679Z,repost:676d0dbf-4cdd-40db-bad2-ee82c78eee98,user:9f2c12ee-712f-4462-abc4-f33ea416afed
repost:1f9da7a1-ed7f-4f41-8434-6eae20215749,Cresco ara complectus thermae arbitro vox arcus facilis.,,,,,2023-10-14T21:53:58.476Z,repost:0dc41fd0-8e83-41a6-ba13-994ec703bc71,user:5299b7f6-fb44-4aa0-9763-a5d115f555a7
repost:2e3631b6-34dd-4f1e-9aa5-4775d2960436,Quod vobis admoveo.,,,,,2024-01-31T00:36:49.192Z,post:28454fef-799e-4194-a595-7b4270d60906,user:3fcd0a7a-e9b4-47e0-81a3-5ce02ca6f56d
repost:5bbb9177-1eaa-4397-8ae0-a794767c03ad,Aro vir vulgivagus facere coerceo varius volo delicate vociferor.,,,,,2023-12-19T18:11:57.128Z,repost:76b35ef9-d2e2-4044-a09d-150aecbbdcfa,user:28196042-dc5a-47b5-afd8-517987cdd68e
post:79d3f9dd-eefd-4bb6-8f67-1940bc1fd070,Solio est adflicto terebro cornu.,,,,,2023-12-26T18:36:16.236Z,,user:fa2e3b53-77ad-4ca9-958c-86f4b43b06cd
post:3cacf1c2-aaeb-4e27-94e9-defae8703c63,Utique aperio rerum defleo curriculum accommodo inventore.,"Substantia verumtamen trans aggredior caries solitudo degenero decens.
Timor facilis quibusdam provident audacia aiunt victus sodalitas coniecto. Adinventitias conor deprecator veritatis. Dolorem depopulo deporto sordeo ullus compello vapulus usitas capio amoveo.",,,,2023-11-19T06:00:10.789Z,,user:3855be2c-c9e8-4f85-beb4-6fbca84c2286
repost:dbb6d5ac-70fe-4675-9c42-b081e49788f4,Incidunt valetudo arceo nisi culpa sopor agnitio color.,,,,,2024-03-26T03:06:14.843Z,repost:718a51b6-3b74-451b-84d1-bc5e66155722,user:c8cbc916-d4f0-4d9e-b0c9-6611f3a797b6
repost:e0c82877-d8a6-468a-8072-f8651e7130f5,Aer apud concido suggero subiungo clam placeat.,,,,,2023-10-20T18:11:51.853Z,repost:b71e206d-ea0b-42b9-ae9b-cfcd7a416a3f,user:0e1b88f2-e06c-413b-aa68-efb1f9f22954
repost:9b9e5258-9163-46cd-afb6-3878c2b2d268,Alter demonstro iste utpote creator facilis inflammatio.,,,,,2023-11-27T06:04:53.157Z,repost:3ca66c15-a196-4ba5-910c-663cc7b81f6f,user:bcc39bc1-52af-4029-9798-489170872aed
repost:99c9de58-e5f5-4576-bb69-4f1f19629212,Tyrannus vos tener tribuo certus auxilium clarus contra capillus.,,,,,2024-08-17T21:25:00.806Z,repost:949490be-425e-4f03-b546-ab7aa296a519,user:20cbebaf-de32-4213-a0fb-ff25d8e53c40
repost:f0152467-6484-494d-a9a3-ad9aee269447,Aetas modi defungo eius solium iure demum adflicto.,,,,,2024-03-26T08:08:16.961Z,repost:e382bc85-6f34-4ebd-abdb-bf70d48fe7b4,user:bca04c77-9b4c-4990-a0ee-160cc2bdc4d0
repost:965af489-ff18-4285-bcf7-c4c0c0930a32,Distinctio spero creo umerus comptus vulgaris adfero temperantia.,,,,,2024-01-25T17:04:37.463Z,repost:5bbb9177-1eaa-4397-8ae0-a794767c03ad,user:20cbebaf-de32-4213-a0fb-ff25d8e53c40
repost:2bfdb251-72a8-4814-bed4-0d93400e9cc5,Solium advoco clam uredo cornu solum surculus advenio tergo.,,,,,2024-01-16T23:07:20.710Z,repost:85fbc402-553d-4d13-8b50-5f8a54c0dd0f,user:bbe0ea5e-4163-4f80-81b1-beb732cbe786
post:a0191d65-5fb3-43d5-8f7c-1d7a82aea42e,Triduana tribuo atavus.,,,,👩🏾‍❤️‍💋‍👩🏻,2024-03-02T18:42:02.760Z,,user:3be12eef-5eab-4a6f-9fd6-c967eb2dd0f5
repost:e01bcfa8-b348-4539-8e20-6cbca701ba5a,Curiositas candidus adhuc decimus adsuesco nobis tenus dolor abbas vespillo.,,,,,2024-06-21T22:29:03.987Z,repost:2b8d2ed0-ddc8-4013-b27c-71ae4651c021,user:0ed4c4c4-99f4-4175-8c31-ee2d15153a46
repost:75ab2e2c-741f-4997-97a1-51fa03d9e36a,Utique clibanus curtus.,,,,,2024-06-19T10:21:14.975Z,repost:62daad26-f97e-4d5f-a4ea-5a3aa74e2a68,user:f0828c6f-e36e-4bef-8f41-4a2efd4e0a80
repost:986177d2-e72c-4010-a136-6608cc230051,Communis voluntarius vitium.,,,,,2024-01-13T15:29:22.881Z,repost:fa4f8290-1969-4c0a-9e01-56855e2f72a5,user:c0593fb7-940f-4bed-b8a9-19c245b82543
post:0115bc29-2a15-4344-8511-3a9c293b711d,Tempora sed adsuesco tumultus.,,,,,2024-07-02T21:36:47.488Z,,user:98b14df8-5b73-4c62-b3e6-0e0f04b79075
repost:0ca5cb8d-8b99-4380-a66f-9803745fe6e4,Textilis voluptas depono amicitia adeptio.,,,,,2023-12-12T14:43:58.480Z,post:57688d99-89f4-449f-ae52-824dfe8ad3fe,user:57fc7dfb-e6c3-4b7f-9c97-4f3433c4ea86
repost:b2ff50e1-bbc1-495e-9b9f-cd11c7027053,Ventus esse turpis velociter sulum alius ipsum validus viridis teneo.,,,,,2024-08-12T08:42:52.087Z,repost:5a585ec5-59b6-4d1c-98b0-d157ae8bb241,user:9815201b-ea82-477e-9fd6-fbc11fbf8fae
post:51dda18f-d09d-457c-b813-acf3b28d23ce,Atavus volubilis claustrum quia suggero.,"Voluptas thermae laboriosam.
Vilis bonus adopto appono.",https://loremflickr.com/640/480?lock=5882152189165568,,⏰,2023-09-03T06:44:36.175Z,,user:dbef5311-2f43-419b-9756-98c2518cd007
repost:bbe90478-1aa7-4b86-aece-4043129a4b14,Valens sustineo uter certus ex corrumpo tergum vinculum cilicium derelinquo.,,,,,2023-08-29T13:27:41.087Z,post:4b0d4203-babf-4273-a942-40bc13965395,user:dc9cae5d-08e3-4b22-bb75-2fd799d8d238
repost:4f12e9ae-dc4d-4ca9-bf8d-eace58451a06,Cervus tubineus cibus.,,,,,2024-01-08T05:24:03.159Z,repost:718a51b6-3b74-451b-84d1-bc5e66155722,user:a03c6d1a-f934-4b49-91e0-abaffdec19f2
repost:858ff9bb-7863-4aee-b364-f6092db5230f,Concedo conqueror fugiat acervus asper damno ars spiculum placeat.,,,,,2023-11-29T03:31:19.215Z,repost:aac4e516-fb02-4932-9dae-c952bed0dba0,user:07e25c21-ba20-43a2-8eb2-ac6c520ceacd
repost:4ac5e783-9459-4199-8445-bd82fff4cda2,Debitis thermae validus abeo alias.,,,,,2023-12-01T22:36:56.489Z,repost:86dcc537-15c9-4498-a327-c491a3c177d1,user:733a0e4d-9e5e-4f77-a6d6-f739427b883c
repost:2f71a33f-0f51-448c-8784-cc36823f29ae,Subnecto adiuvo clibanus consequuntur.,,,,,2023-09-04T04:19:43.575Z,repost:b2ff50e1-bbc1-495e-9b9f-cd11c7027053,user:85625e6d-c20a-479e-9787-b52d1810f311
repost:c9e59e35-bea7-41e6-93bc-a4d611b21d3f,Utroque ultio vehemens.,,,,,2024-04-01T21:16:31.170Z,repost:5a585ec5-59b6-4d1c-98b0-d157ae8bb241,user:b487af03-0c47-4ed3-a7fa-b9c4f7c65057
repost:9b27ab2e-bef6-4aaa-b2bd-999a0c636ab1,Decimus ustilo aestas quibusdam deprimo sint cubo.,,,,,2024-08-05T23:07:09.401Z,post:f0e2f8f3-d2db-4165-8c8f-2c761b3f7cf4,user:73aa00b3-03de-419c-9021-4988fac19d67
post:cd26b156-5623-4b60-a254-96e6c4b53dac,Animadverto carpo conspergo.,"Triduana tunc clarus universe usus terga paens sursum sunt.
Aureus casso vallum acervus turpis umquam stella artificiose ultra velociter. Trepide temporibus vesco sollicito corona succurro laudantium avarus aggero. Vis derideo defungo abduco vilis stipes delego.",https://loremflickr.com/640/480?lock=6228451904192512,,,2024-02-13T16:11:59.212Z,,user:7bd66ff6-cde2-487b-9a7a-f2d8c6ce7e9b
repost:946ed978-019c-48bf-a181-d03e59a61803,Validus ventito aufero delibero exercitationem alius viriliter.,,,,,2023-11-27T20:40:20.167Z,repost:d955e1d3-065e-48b0-9057-76abe4c76536,user:2af5ad94-5c20-486f-a434-bbcac84075de
repost:12f9275e-dc7f-4521-b44c-d7a1195dc36b,Aegrus adipisci crinis volutabrum.,,,,,2024-02-26T20:58:50.298Z,post:bbddfd37-09ac-4d47-ae06-b1a301be1eaf,user:e31bc7a2-fd34-4498-b129-17cc3e282705
post:6f0cb918-8327-4a4f-a9a7-37d48f7ca739,Deorsum talis cicuta curvo accommodo ademptio quo exercitationem conscendo.,,,,👽,2024-01-03T18:57:22.998Z,,user:04e922eb-65d4-4673-a105-fe6ed3cdf5b9
repost:73f86fb0-c93f-4e0f-a094-4170302d907b,Vivo carpo surgo deporto caries crapula.,,,,,2023-09-30T01:12:40.987Z,repost:a4239d4f-2839-40dd-bcc4-0b054d2be63a,user:3bdfe7dd-9a57-498d-a24e-fe2ed3c789ca
repost:d5df5eb7-0d15-4e1d-8a19-069581fc5c4d,Caries excepturi reprehenderit pariatur paens adsidue benevolentia accusantium.,,,,,2024-07-25T09:13:35.038Z,post:48c3b85c-b7f8-442d-8440-867bc2267625,user:1c79a862-839a-458c-9870-cd657f774899
repost:8433fd2d-23be-401a-83b1-cc0380098231,Statim sumo volup quo unus voveo alo.,,,,,2023-11-17T08:29:05.685Z,post:aabb4300-9326-40d8-85d8-91c70044f9f1,user:4826b7db-800e-4aa7-adfb-784b16c86ac7
repost:f6e7c53a-38ba-4239-a012-41f1bd975c64,Depereo derelinquo deserunt corpus beatus.,,,,,2024-02-01T14:20:23.901Z,repost:bacb1c0e-ae50-4a86-a424-be6c5647ee8d,user:0b192284-fb34-4340-9c9d-fdde4b42f155
post:8ceb2adc-566d-42f9-9e4d-d31a6b07e3f4,Aspernatur totidem despecto repellat tremo antepono.,"Summopere quasi deprecator aranea votum. Solio cursus autus thorax auctor ea. Quod considero tepidus adipiscor corona solus voveo caste avarus dicta.
Cohaero at accommodo veritatis ex cerno torrens concedo tamdiu aedificium.",,https://oval-efficiency.org,,2024-06-16T11:23:09.916Z,,user:2cd09070-963c-4fba-a1dd-9ae0c43f69db
post:53cec74d-132c-4670-aaca-c54a716555dc,Temporibus copiose ambitus causa laborum apud strenuus sumo totidem.,,,,🔶,2024-07-20T18:33:27.721Z,,user:88e8edeb-11de-4bf6-806e-13a74642672a
post:d0ca91b4-3716-428b-a943-0606c5ce0646,Cultura censura volup.,"Ver coerceo suscipit civis aureus depopulo ab nobis suscipio.
Cervus aetas titulus voluptate unus succurro stips contego trucido. Amitto vir volup. Suadeo bis abeo abduco thorax curso.",,,🛫,2024-05-16T13:46:13.470Z,,user:76742fac-803a-4fe4-88ae-3c2a03d6aba6
repost:e4e1269e-1834-4800-a71e-f11482e9286b,Vere calculus quisquam asporto apostolus calco angulus amo accommodo alioqui.,,,,,2024-03-01T19:08:52.812Z,post:c36f96b8-b86e-4afb-b00a-f57dcbb2be37,user:9a6ea860-4ead-47a3-bba2-c40c108b9719
repost:02699bc6-595a-41cd-bd43-0575f5286fed,Catena capitulus aptus paens temeritas capto vester cursim.,,,,,2024-08-15T07:36:36.545Z,post:28454fef-799e-4194-a595-7b4270d60906,user:f68cefd3-71bf-4afa-ab81-e19b6741f156
repost:fbbc14c2-8405-488d-8f9d-511d1b1ff7b0,Comedo suppellex temporibus compono vaco baiulus adhaero odit contigo qui.,,,,,2023-11-21T18:23:51.827Z,post:ea8ff43a-206f-44dd-b623-d6cc04cfc11c,user:ee8aaddb-01fd-4cdf-b805-458636837364
post:36d8dd87-3222-4838-b32c-2b4bf2d5d314,Tenuis conor talis.,,,,,2023-12-02T17:51:32.171Z,,user:484858f8-1fa5-4d9b-a760-11e3914a5ee6
post:dd973071-db8b-43bc-805a-fac9b229fa95,Synagoga terror copia conicio thorax.,,,,🇨🇴,2024-03-25T11:45:56.291Z,,user:f9287df0-dc52-4670-847f-f0c63d40bcb9
repost:a25bb137-d7ef-412a-9d33-d52a6f984da6,Tantillus tersus eveniet.,,,,,2023-08-27T07:06:01.395Z,repost:f9d7d783-84c4-4e48-a916-feb673caf374,user:baefdf08-4f9e-4f1b-b1f4-b72559ed8c64
repost:4246e604-c47b-46b2-b73e-523e6d85e5bb,Voluptate synagoga clementia.,,,,,2023-11-12T06:35:13.301Z,post:0b564d6e-a8f8-4a57-80ff-2833b059402f,user:7a4a022a-c2c6-4da3-94c9-399e1c8ae655
post:aca30bca-2bb8-44b6-aed6-e6703082d8e6,Ut animadverto ea thymbra atqui.,,https://loremflickr.com/640/480?lock=7147561733324800,,,2024-07-11T12:58:55.162Z,,user:f0828c6f-e36e-4bef-8f41-4a2efd4e0a80
repost:7cc56a5a-1d08-47b5-a2e6-8ee823658944,Rem cubitum stips provident quod textilis.,,,,,2024-02-11T23:38:10.212Z,post:5d190438-65f6-41f0-a743-322632b8c45e,user:f45b6c0a-5a8a-42b1-864b-8a90ed55eb4b
repost:b25e56ea-5901-4e46-8c2a-9c16e6724830,Timidus asperiores laudantium usus.,,,,,2024-01-16T21:15:01.992Z,repost:86dcc537-15c9-4498-a327-c491a3c177d1,user:6cad3c1c-a719-46bb-88d8-fd670ac52adf
post:c21ebe96-26d3-455a-8f00-f33de5062c42,Aspicio cibo rerum antea statua alter ara.,,,,,2023-11-08T11:20:59.170Z,,user:f99080a0-221d-4b29-8947-873b80bc3b3d
post:587025ec-ea37-401b-a312-66827df9d57a,Tristis totidem deludo.,,,,,2024-04-03T14:12:23.238Z,,user:9a1beada-6f47-4b2f-aec4-8aa2c1881d20
repost:07c14220-6c41-4774-a258-5839b2c1522e,Curto cruentus molestias suscipio.,,,,,2024-04-05T17:49:58.462Z,repost:7d354bce-bf4b-4030-9baa-30c29d205b86,user:bbe0ea5e-4163-4f80-81b1-beb732cbe786
repost:3816d851-55d8-4b3c-beec-6e1cebe4b1fa,Eligendi congregatio avaritia sto tubineus.,,,,,2024-06-26T21:44:22.017Z,repost:2bfdb251-72a8-4814-bed4-0d93400e9cc5,user:411ac596-2b88-49dc-a4b1-2587083bf1b9
post:5ec8b313-b7a6-4b48-804f-b0231915c9e4,Admoneo defessus somnus teneo.,,,,,2024-07-01T16:23:42.706Z,,user:5d0343dd-137b-4cd2-ad09-f3e66fead824
repost:6eeac5ac-1f53-4973-a23d-5259fb08cb94,Solus ratione vesica tactus deprimo inflammatio vorago adversus.,,,,,2024-02-03T16:49:20.676Z,repost:57f5a11b-50fe-4605-a46c-531f27bae4d2,user:0b192284-fb34-4340-9c9d-fdde4b42f155
repost:2b84c92a-6110-49e2-bcea-6258428a026a,Arguo umquam subvenio alius.,,,,,2024-06-01T09:29:02.132Z,repost:fd22dd81-87ea-4336-930a-b2dee5b56839,user:895cc69c-50d7-413d-900a-01babcafcf5c
repost:b4cca5ec-dd61-44cf-92d0-3f043aefaf41,Sustineo antepono theatrum currus adhaero casus.,,,,,2023-09-08T03:43:02.271Z,repost:bacb1c0e-ae50-4a86-a424-be6c5647ee8d,user:0989c27a-f400-4d30-84e4-32b563abc0ae
post:ff578dc4-0aba-4073-b672-b5e50ef1ae7b,Conspergo comes aufero cavus thermae tenetur audeo conculco odio.,,,,,2024-03-12T18:25:12.524Z,,user:ff7f9adf-0f1c-4787-af62-19ca1e22d900
repost:8f6bf339-858e-4a90-b94c-e665a5b80765,Volo abscido clibanus stabilis vir sufficio calamitas.,,,,,2024-05-31T10:16:16.025Z,repost:eb3a7662-9e7f-4c5d-a919-ea3382636615,user:cf673f1a-c723-41e3-a9bf-7968b95728fe
repost:7057dd53-3efb-4a40-aa6c-9086610917f3,Comitatus sulum acerbitas demo baiulus aduro.,,,,,2024-05-11T13:01:48.569Z,repost:a333c3cc-8591-4650-a131-71ccc6060456,user:84bf8f4c-4b42-4830-8bcf-ef017c6e5547
repost:2ceccebd-b919-4f40-a22b-958a471f8914,Vester stella libero cognatus acquiro cunctatio bene thema.,,,,,2024-05-31T11:55:03.612Z,repost:12f9275e-dc7f-4521-b44c-d7a1195dc36b,user:68f3d146-d296-46a8-84c6-716f25397c7b
post:df0e3464-0b78-409c-8404-16bb9e283cd2,Adfectus contra corrupti cursus numquam.,,,,,2024-02-18T10:08:51.002Z,,user:d5d73454-7f37-4b07-9af0-c00dca57aca6
repost:4301235a-caad-4b0f-aa80-f13d572ddf50,Ancilla celo ciminatio quod deleniti quas umquam uterque derelinquo comburo.,,,,,2024-01-19T04:12:06.742Z,post:36d4e177-c30f-4a46-ad42-3edcb60b92c5,user:76742fac-803a-4fe4-88ae-3c2a03d6aba6
repost:9e2589c5-6e62-449d-a448-69ec1756fc33,Peccatus cubicularis velum vitae temeritas carpo.,,,,,2023-12-26T22:42:42.143Z,repost:85fbc402-553d-4d13-8b50-5f8a54c0dd0f,user:733a0e4d-9e5e-4f77-a6d6-f739427b883c
repost:44068ed0-11ca-4117-9f4d-f686ce0909ec,Temeritas alter vulnero fuga.,,,,,2024-05-10T07:58:55.729Z,post:8863d2de-04f9-48e8-a68c-41eed695a41f,user:4bb722af-4b6d-4417-a85c-f5bba299a69a
repost:c6388fa8-b1ce-4830-9c54-b5091fc44cfd,Tenuis comis clamo thema pauci calculus absque contigo.,,,,,2023-09-25T08:06:44.747Z,post:0b564d6e-a8f8-4a57-80ff-2833b059402f,user:4bc06a0b-d376-429e-8910-416e9bc7b5c3
repost:fe907ef2-75e7-4837-944d-2c26dd034412,Vorago desparatus vulticulus.,,,,,2024-07-27T03:02:42.384Z,repost:07c14220-6c41-4774-a258-5839b2c1522e,user:534ab6dd-97b8-4434-95dd-09926725e8d3
post:72891816-bc3d-49aa-ac7b-d94c9f2a55d3,Avaritia vereor bonus quas sopor.,"Despecto commodi vergo.
Esse aliquam conspergo amo depulso pel odio capillus. Cur odit vicissitudo arbor surgo surgo. Summisse vomito abeo cariosus subvenio qui pariatur.",,https://belated-tennis.com/,,2023-12-31T06:35:06.744Z,,user:0e1b88f2-e06c-413b-aa68-efb1f9f22954
post:1e7907e3-ca5c-41d8-8d6d-f8f4eb89d443,Arcus sustineo deleniti congregatio suffoco conqueror.,,,,,2024-04-14T18:15:20.582Z,,user:81a22185-6536-4be4-a431-e51d3bc17cfe
repost:e5048cae-12c1-4fe4-a912-3a11654d252e,Tenetur amet vereor suffragium rem denego qui talus.,,,,,2024-02-12T02:33:35.416Z,repost:676d0dbf-4cdd-40db-bad2-ee82c78eee98,user:a962f856-ee18-4228-bbb5-2347fe86229d
post:92e75b3c-f10a-466f-9bd5-e4a83b988d52,Testimonium patior consequatur accusantium.,,,,,2024-01-09T09:40:42.887Z,,user:d9f573c6-dfb8-495c-9afa-23f9de333125
repost:022806e6-b43b-4c04-a5d1-cd2d560bcb2a,Campana ars vergo utpote creator tergo adversus cohors.,,,,,2024-07-18T15:19:40.020Z,post:c3990fa3-ffc7-4645-83e1-182a8706fdd1,user:f76e7d83-954b-4654-a7e6-5e74de2feaf0
post:901ed328-1272-4ce9-bcaa-309a7893253f,Atrocitas creo tergeo pariatur carbo ullam avarus.,,https://loremflickr.com/640/480?lock=1290923763826688,https://quarrelsome-county.org,,2023-11-18T03:12:24.693Z,,user:a20ef653-3305-476c-8811-3b0785cdffa2
repost:d96caf0a-a274-4fb0-a75f-fc400b665119,Communis vae alioqui angelus cresco asporto cubitum super decens.,,,,,2024-06-21T04:54:55.611Z,repost:8e202bd4-df34-4ae1-a745-b5355ad0e7ec,user:650653dd-5ad0-4752-8431-c690c6224259
repost:69d0a4f5-428c-4406-bb18-d6cca804698d,Maxime verbera comparo crinis.,,,,,2024-01-26T02:06:58.023Z,repost:b67aa99b-4c40-4f68-a795-ac330cb0e35f,user:67f7efe9-14e2-43b1-b404-941893da200c
repost:9aca96f4-f707-4463-a121-4cc2b99cd9ef,Theologus averto vapulus.,,,,,2023-12-23T21:16:57.993Z,repost:4301235a-caad-4b0f-aa80-f13d572ddf50,user:d9f573c6-dfb8-495c-9afa-23f9de333125
repost:e32c46cf-3bdb-41e7-8598-2fff666b5531,Aduro cibus esse eveniet communis substantia toties tracto abstergo.,,,,,2023-09-01T18:05:03.688Z,repost:0fba2357-007e-4369-8f77-11dfa58817a9,user:b8d06f2b-d3ca-42ca-9b0c-fc9ff8ddb080
repost:bff9c2e2-94d2-46ee-9f5b-b2b117b256d5,Peior alioqui centum vomito caelestis.,,,,,2023-10-06T03:38:43.118Z,post:51dda18f-d09d-457c-b813-acf3b28d23ce,user:cce5d540-2683-4e5c-9b05-2e0b0e916569
post:a2fa0f3a-20c0-447a-9285-43b321fc533d,Accendo somniculosus advenio appositus suffragium.,,,,,2024-06-13T23:57:33.570Z,,user:aa54cd82-7fc9-4dae-9ed6-6d36c3829d21
post:805a9e8c-32cb-40ac-b911-ffef7dd3bd13,Comitatus amita cultura.,,,https://physical-spring.org,,2024-06-28T13:21:11.900Z,,user:cf673f1a-c723-41e3-a9bf-7968b95728fe
repost:9ffc8a1f-6ac2-4950-851c-69d798b1fbf4,Solium vester accendo defluo cicuta cursim derideo.,,,,,2023-11-23T19:36:32.293Z,repost:facbcead-264b-48ba-b91c-831be897c543,user:e31bc7a2-fd34-4498-b129-17cc3e282705
post:4e7235be-c6e8-432c-a95f-ae7d66272bed,Amplus succurro volva concido conor uberrime adamo.,"Ait thymbra comedo tubineus enim.
Arbustum ullus tametsi provident defetiscor fugit vox. Bis copiose conor candidus.",,,,2024-08-18T04:07:02.747Z,,user:04e922eb-65d4-4673-a105-fe6ed3cdf5b9
post:45e7751d-82d5-41b9-a6e0-7bcf40c06e61,Templum adaugeo ustilo verecundia.,"Dolore arcesso commemoro ustilo viscus depono.
Stips angustus ambitus commemoro comes dolorem bibo solvo dens amaritudo. Deprecator ad arbitro absque.",,,⛹🏻‍♀️,2023-10-13T07:19:17.637Z,,user:cce5d540-2683-4e5c-9b05-2e0b0e916569
repost:760c4e4d-5e47-4f3a-bd3d-7e2f1dbf12dc,Patior sursum surculus auctor antepono conitor nostrum vivo.,,,,,2023-09-22T15:34:45.166Z,repost:fa4f8290-1969-4c0a-9e01-56855e2f72a5,user:5906cf07-397a-4d42-b993-c952a5918aad
post:03707113-af3e-44eb-a43a-e737dc7b12fa,Voluptatibus suffragium quae quia inventore spectaculum coerceo tondeo.,"Abscido conicio atrocitas commodo. Celer vallum curiositas facilis ulciscor basium capio. Aliquid stips vester terreo uberrime ara curto creta suppono.
Cohors bestia celo dolorem damnatio universe colo viduo voluptates. Ventosus cupio consequatur ea calculus nemo velociter pauci voluptates comis. Alioqui constans denego volo vulgus eos vir communis.",,,,2024-04-26T21:35:50.673Z,,user:f45b6c0a-5a8a-42b1-864b-8a90ed55eb4b
post:1e10a0b4-8990-44cd-ada4-bc05b80cb8a7,Adhaero succurro cur.,,,,,2023-09-16T01:40:11.629Z,,user:80f4e8b4-d075-459e-b3c7-931ee639d51b
repost:4cdd7c4e-7547-4777-8942-b6752f677b12,Theca pecto stips terebro.,,,,,2024-07-14T07:55:21.989Z,repost:c5da3cc6-7250-452f-9cc1-161fe71d590d,user:11fa7d69-dc43-4d98-9573-d2e1f15580a7
repost:af31b3d4-7f69-452c-9bac-b73b060c1442,Cunabula taceo ustilo averto universe cribro aro.,,,,,2024-01-01T05:27:27.675Z,repost:155f7dc2-da1f-4404-a858-38fe928e10b3,user:c642b8bc-82ce-4c5a-b0b0-1001aebcac1a
repost:efdd5a74-8a83-4b47-a872-2a812eaaff23,Argumentum tredecim valde volutabrum quia.,,,,,2024-07-17T05:09:29.451Z,repost:c6388fa8-b1ce-4830-9c54-b5091fc44cfd,user:acba9a2a-a6d7-486b-a453-351a047281ea
repost:6ea2e521-2094-4966-a0bd-c0e38b369559,Defluo verumtamen cognomen ex veritatis.,,,,,2023-12-31T00:58:37.399Z,repost:4301235a-caad-4b0f-aa80-f13d572ddf50,user:c0593fb7-940f-4bed-b8a9-19c245b82543
post:178d50c3-38ae-43e1-bc51-1b04ecc0d0b7,Omnis adsum trado.,"Appello carbo abscido capio quisquam appono angelus aeneus. Vir ter vapulus ducimus subito. Deserunt carus taceo curia verecundia spectaculum.
Taceo ubi subito suppono desidero inflammatio. Cultura certus adipiscor agnosco. Complectus ex dedecor.",,https://well-documented-professor.info,🎿,2023-08-30T01:36:54.290Z,,user:37faa4ee-aea6-4cae-af6a-32b71a93e1fe
post:b0dff11c-481c-4bdd-97c6-1d22aaf40dd0,Caterva amitto terebro administratio cura administratio calculus odit.,"Cena adulatio solitudo articulus ait apto. Auxilium veniam incidunt curso strues claro vesco esse. Suffragium comes admiratio una delinquo commodi.
Talis ab alveus. Contra deorsum auditor. Communis tempore ciminatio denuo dicta vicissitudo vesco colligo abstergo.",,,,2024-06-18T01:39:33.428Z,,user:6f768309-58ef-495b-b484-bf720334c452
repost:8f6b58f1-4b56-4da5-87e6-db24ad232ab9,Corona tondeo quas quod.,,,,,2024-01-28T11:52:00.104Z,repost:8d0471e5-597a-4f92-93b2-905691742e49,user:4eebebf6-d42f-4316-9f37-2a68dbe719c0
repost:61c1ad3c-e700-447d-bf1e-55136b2e42d7,Allatus avarus carbo animi temptatio auxilium comburo victus.,,,,,2024-05-30T10:35:06.580Z,post:dbb76308-c786-42d8-a9de-5cedf68b181c,user:c8cbc916-d4f0-4d9e-b0c9-6611f3a797b6
post:4383af3e-6f6d-4483-b2a5-e53b1379486a,Conicio carbo viduo.,"Auctor accedo conduco ago odit. Crepusculum cur bibo temporibus adduco suscipio.
Creber tergeo amplitudo peior tergeo accusator centum accedo alter tibi. Confido creber solio admoneo vir quam culpa curvo. Appello doloribus acidus advenio sopor adhuc territo caritas laboriosam.",,,🪦,2024-03-21T20:38:24.266Z,,user:fc9f89f8-c018-46d5-9b7b-f86698d91c14
post:2f4e656a-9c49-4545-be57-28263a2d181d,Alveus virga vociferor clam adipisci confido cado.,,,,👄,2023-09-16T22:57:27.340Z,,user:578307f7-f11c-4ecf-a6aa-fdaa19883570
post:6212043b-bf20-4314-9377-972db276aa38,Adhuc aduro adulescens clementia adficio.,,,,,2024-02-26T19:49:16.244Z,,user:ab8b47e9-41e0-4a12-bfa3-8744b8ccbbfe
repost:b126c1ea-5a75-462c-83a7-e73fafb9a93a,Vulgus demulceo votum amplexus caecus aestivus texo esse aeneus vinitor.,,,,,2024-03-08T09:41:19.839Z,repost:52a22912-55a3-46d9-a764-5b963b6d6a57,user:a03c6d1a-f934-4b49-91e0-abaffdec19f2
post:7221f93a-cf75-41ff-b0e7-1eb1ae18994a,Denuncio subvenio uxor apud aut.,"Suggero tergo contego cruentus sumo.
Cognomen contabesco conturbo cras assumenda. Cura super sol cras saepe tantillus degero.",,,,2023-10-24T14:18:48.824Z,,user:3550c9d0-47c3-42f5-b294-da35064e074b
