id,headline,body,image,link,emoji,created_at,repost,author
post:47876115-9e76-44e4-bcc5-709b47d82228,Chirographum aedificium currus.,"Eius certus celebrer totidem taceo capio vulgo cultura. Praesentium aeternus tersus caelestis credo voluntarius adduco.
Utroque cursim tutamen cruciamentum. Strues totus tam substantia tibi calculus chirographum tendo patruus basium.",https://loremflickr.com/640/480?lock=3680156266790912,,,2024-08-08T23:51:28.226Z,,user:1af1a4ec-5ff7-45ce-8201-85c5c037989d
post:7bded41f-91d1-40e0-9421-fa0c3059b5c7,Solium minima tamquam animi aggero deporto commemoro necessitatibus.,,,,,2023-12-26T13:14:43.659Z,,user:41567743-a521-4edb-8bfe-ae58fb36dfb8
post:83002976-e652-460b-af93-04f594117790,Amor utpote canto decretum crinis auxilium causa succedo dolorum arma.,"Thesis temperantia suadeo. Id distinctio absens officia cupio crastinus virtus. Canis consequuntur decipio vox vociferor aiunt patrocinor.
Cernuus pariatur trans vobis tredecim somnus vesica acerbitas expedita tondeo. Defero accedo deorsum curtus quod aperiam.",https://loremflickr.com/640/480?lock=5876718566899712,,🤯,2023-09-25T15:39:13.912Z,,user:449577dc-c73d-4df4-a243-55deb8bd48ea
repost:f8a0ae53-f81c-4854-8bd2-90f840054e74,Tubineus praesentium repellendus amplexus calcar curriculum optio crinis demonstro aiunt.,,,,,2024-05-06T21:24:15.117Z,post:72891816-bc3d-49aa-ac7b-d94c9f2a55d3,user:5f180356-9017-4066-9301-ed55bfad0a01
post:e9ce1fd1-0f5c-4ed0-a8ee-e05b9d67f69c,Accedo sursum quia.,,https://loremflickr.com/640/480?lock=1169788659302400,,💗,2023-11-19T22:35:08.774Z,,user:ddd06aef-7ebc-4ab9-b19f-18eac6ce32c7
repost:68fb9185-3f85-4179-9144-5c92cd3c581a,Caecus ater alter.,,,,,2024-04-18T11:20:30.310Z,repost:4a6fb61c-bda0-4f40-9b53-76e3d74c4bb2,user:7be3bff6-b148-45a9-9d42-81e385524692
repost:de40ef55-99a4-4a36-ab85-422732bf5db2,Conduco terga combibo utroque decumbo titulus succedo sollers.,,,,,2024-03-15T19:53:50.056Z,repost:4a6fb61c-bda0-4f40-9b53-76e3d74c4bb2,user:1c79a862-839a-458c-9870-cd657f774899
repost:7ffc24c7-900a-4121-926a-917ced2a9345,Spargo villa ascisco copia animus patruus.,,,,,2023-12-23T04:05:55.715Z,post:0abdd0e3-93cc-4553-8d0a-ee04e0679f56,user:603b18cc-48ef-46cc-beba-30ebdb000dd4
post:35c049de-3a46-488f-9316-fa410fa868e1,Solvo corporis vere vitiosus officiis vetus confido tamquam.,,,,,2024-06-18T21:03:18.355Z,,user:348d6d86-30b0-4649-9905-039ae678839e
repost:505b4ac8-7a54-4520-bd69-4cb36db66b63,Cicuta tabgo commemoro adsidue ater thermae.,,,,,2024-07-08T07:39:57.419Z,post:f10461fc-4a69-42a9-a71a-9f11f7c929e3,user:ee8aaddb-01fd-4cdf-b805-458636837364
repost:9d829a5d-9def-412a-8073-5fca940b0005,Maxime valde tamdiu considero spes currus volo denuncio combibo doloremque.,,,,,2024-02-26T16:12:41.244Z,repost:9b27ab2e-bef6-4aaa-b2bd-999a0c636ab1,user:348d6d86-30b0-4649-9905-039ae678839e
post:a6d8c1e7-fd15-4181-b719-3a9ab4044458,Bibo tabgo benevolentia audentia.,"Aggredior tempus casus. Cruentus voro voluptas thesis rerum triduana acquiro clamo. Supra aggero artificiose texo depulso sponte alii.
Corona tandem vomito cornu deleniti neque. Cerno odit solus theologus. Cohaero amplitudo terreo cuius tabula abscido deprecator repellendus vesco trucido.",,https://difficult-netbook.info/,,2024-06-30T09:07:25.838Z,,user:534ab6dd-97b8-4434-95dd-09926725e8d3
post:b566f8d3-e5a4-4a1f-8bb5-e16f565cc080,Trado comburo comitatus acceptus aestas apparatus supra viriliter confido caste.,,,,,2024-04-25T21:11:12.656Z,,user:650653dd-5ad0-4752-8431-c690c6224259
repost:99c96c93-7f4f-4b77-88d1-d357bfc53517,Quae dolorem vesco enim suadeo atqui.,,,,,2023-09-20T09:05:29.342Z,post:1e10a0b4-8990-44cd-ada4-bc05b80cb8a7,user:4a4b6ce7-344f-4f9f-9e77-62892677b191
repost:611f5c10-3edc-4a3f-85d8-3ab79bb9190e,Cursus tamdiu facilis.,,,,,2024-02-04T01:06:34.613Z,repost:e4e1269e-1834-4800-a71e-f11482e9286b,user:534ab6dd-97b8-4434-95dd-09926725e8d3
repost:4c12cb75-b903-4f48-b22a-f1748755d18b,Verumtamen error suppono antepono dedecor.,,,,,2023-08-28T07:11:13.271Z,repost:bbddf614-79ad-4576-bd23-627aa4878b9a,user:790fcf85-9418-4619-8e3b-a924851a477c
repost:a877d8fa-14af-4e87-b651-adff40bf8bf9,Suasoria aegre verumtamen curia sequi.,,,,,2024-04-24T20:16:20.420Z,post:3b8efe6a-21f4-449b-9ad3-c7974378c7cf,user:f9287df0-dc52-4670-847f-f0c63d40bcb9
repost:b40eab22-8549-46c4-b713-fd05af1b5405,Conspergo spectaculum thorax demitto sumptus supra adipisci dolor.,,,,,2024-01-25T18:25:24.317Z,post:6328e42f-0b05-4815-b8a1-5226b6415852,user:4bc06a0b-d376-429e-8910-416e9bc7b5c3
repost:d4454b94-6da8-430a-b11f-a75038aa3daa,Curis carcer iure.,,,,,2023-09-21T00:10:28.175Z,post:3458811a-5372-4813-bcb5-11de5171d493,user:9a6ea860-4ead-47a3-bba2-c40c108b9719
post:c0606662-4452-407b-9d32-bde1e1aa86e4,Tubineus est decet audacia.,,https://loremflickr.com/640/480?lock=194205735452672,,🦃,2024-07-10T09:35:14.560Z,,user:28196042-dc5a-47b5-afd8-517987cdd68e
repost:64cd2bfc-8787-4d02-bdb8-966cba808ef2,Crudelis celebrer amiculum defessus sunt bos amplexus antepono.,,,,,2024-08-21T11:37:20.560Z,post:b44c8f90-383e-4597-b15c-18b70f43dab6,user:a48ca412-e522-481a-b879-032fc7b12f60
repost:40b0dbf0-d5d7-4799-99b3-0f952fd53dbf,Depono socius cresco.,,,,,2024-03-04T20:06:16.621Z,repost:0ac41e9b-de39-4c17-b41c-bb2bd1ea68d5,user:1cad5c98-867e-4a1d-92ac-9774520da4c4
repost:b3bd33ca-ce35-442c-bbf6-6afd191a88d0,Claro molestias vacuus ubi vapulus appello derelinquo stultus.,,,,,2024-01-15T14:17:54.556Z,post:3458811a-5372-4813-bcb5-11de5171d493,user:847aef53-8e28-448a-8857-4f1fbb1e1d8e
repost:07281498-086a-4409-9fdf-5892684ffb25,Clam magni amicitia decor.,,,,,2023-09-17T04:47:17.935Z,post:5d67c66e-2e55-4b50-a520-48a3129d9ac8,user:3a688105-8d26-4771-8250-f5f3d19faa1b
post:15cf9904-3c74-4699-ab50-4ab0f3f161cc,Una voluptas cotidie explicabo amissio atqui laboriosam comis creptio.,,,,🔁,2023-10-14T13:31:53.667Z,,user:4186ef71-1759-43a8-947a-a0191728a726
repost:8a24efea-d103-45bd-a11c-0234eebb442a,Vero vero adficio provident excepturi canonicus demulceo.,,,,,2023-09-24T10:33:46.203Z,repost:e7735847-11d5-4671-b482-a1abce8f2533,user:a45af038-fdb7-461d-8039-30c99df43661
repost:9ff1eae7-5e2b-4f0d-a19b-ea04cc6fc330,Bibo ventus stultus tremo spero supplanto.,,,,,2023-10-27T10:56:57.160Z,post:a0191d65-5fb3-43d5-8f7c-1d7a82aea42e,user:5f180356-9017-4066-9301-ed55bfad0a01
repost:d6b509f4-70c1-4f7a-b1dd-2f54c5fb0702,Voluntarius vaco minima debilito nisi tempus sol communis omnis.,,,,,2024-06-18T11:39:55.993Z,repost:68fb9185-3f85-4179-9144-5c92cd3c581a,user:04ff178e-b0cb-4a75-94b1-18195ba59ea5
post:75be9ee2-71bd-4835-81c1-b1d38552c00f,Utroque socius virtus dolore aegrus amo quasi.,,https://loremflickr.com/640/480?lock=8392472621219840,https://unwilling-repeat.org,,2023-09-04T08:55:44.780Z,,user:a45af038-fdb7-461d-8039-30c99df43661
repost:79565f45-8be5-48e6-8ff7-2df80ad914ff,Vere cenaculum comparo censura trepide casus.,,,,,2023-11-02T16:18:24.398Z,repost:936d373f-b0a5-4bc9-8a58-5b6011027868,user:74ae777f-a23a-4cf7-9dfb-8e6855c7e62c
repost:d9d32001-24c3-4223-b542-6b9e955f97b2,Urbanus aufero circumvenio tot barba.,,,,,2024-02-03T03:50:44.942Z,repost:aff362bf-9751-4376-9c54-1378c34cf69f,user:9a6ea860-4ead-47a3-bba2-c40c108b9719
repost:e6db5205-74ef-494d-aa7e-c88dabccdedc,Currus volutabrum ademptio coerceo condico occaecati adimpleo.,,,,,2024-02-18T08:50:37.009Z,repost:8f6bf339-858e-4a90-b94c-e665a5b80765,user:d5d73454-7f37-4b07-9af0-c00dca57aca6
post:f8508a76-0fac-4486-b21c-408649ac79e8,Depopulo atrocitas ancilla adsuesco rerum.,"Demonstro strues vulpes avaritia claustrum autem arto varius.
Sophismata sed tardus.",,,🎯,2023-11-26T10:07:01.924Z,,user:04ff178e-b0cb-4a75-94b1-18195ba59ea5
repost:99dde1c9-92a8-471e-8534-84baacc1a1fc,Degero deduco eaque appono alter.,,,,,2024-01-27T18:50:11.336Z,repost:6b97f40c-f47c-4b63-b389-76a9f75258e6,user:4a4b6ce7-344f-4f9f-9e77-62892677b191
post:5b9c28f9-cbda-4f9b-9468-0417386e3a5a,Bellum deduco advenio arceo correptius deficio autem vir tibi administratio.,,,,,2024-05-03T08:40:56.680Z,,user:5906cf07-397a-4d42-b993-c952a5918aad
post:09adcb46-bbbd-4662-a017-2b4e96a60bf5,Tibi tabgo tibi sequi cohors usitas cur congregatio.,"Terror tempore demum ars pel desino id confero. Dedico aranea amor audio aufero unde velit verumtamen cauda sursum.
Altus appositus tener varietas torrens tribuo acidus tactus defero.",,,🇳🇷,2023-12-24T10:48:51.212Z,,user:f5ee87ca-a581-440d-8b75-e8f180b30961
post:38ab32c2-2dd1-439d-9276-856619b62277,Fuga adulescens statua arto compello arceo cribro.,"Rerum curo incidunt demitto creta aetas reprehenderit suffragium. Caecus vir eveniet una.
Attero soleo cursus decens venio. Caritas argumentum tergo copia adipisci valde sum cupiditate corrigo. Decerno volubilis temporibus molestiae adversus at.",,,,2024-01-29T22:17:39.346Z,,user:bcc39bc1-52af-4029-9798-489170872aed
repost:b1b0feed-216c-43ab-bd56-986bd319ce13,Vester contra tumultus argumentum sophismata tricesimus ipsa defaeco aestus corroboro.,,,,,2024-03-11T09:58:18.074Z,repost:ca802482-25ba-4518-ba74-2d4acc3f795d,user:dbef5311-2f43-419b-9756-98c2518cd007
repost:48fb0b03-f86d-44da-9a9f-b706db2fa591,Non occaecati itaque calculus.,,,,,2023-12-07T22:26:11.402Z,repost:eb3a7662-9e7f-4c5d-a919-ea3382636615,user:1dea3073-4817-43af-83ac-5470f4b14c2f
repost:bd5c97de-2979-417b-856f-a4bffd46796c,Vesica cotidie sublime surgo minima callide magnam.,,,,,2024-08-11T09:07:27.464Z,repost:922b684b-5337-46a8-a9ec-bfc23f4feb42,user:ea4cd056-cea8-4a22-b989-2c011738393c
repost:0f87f880-2b11-44fc-ab1a-9db1c1659a5d,Tener ea sperno spiculum ancilla delinquo una temperantia arbustum clementia.,,,,,2023-12-12T05:40:25.958Z,post:ef01b9b3-7aa3-45b5-a141-0a71c01f4985,user:4a4b6ce7-344f-4f9f-9e77-62892677b191
repost:8a5902ea-b07f-4cec-8008-85ab08376ffc,Deserunt terreo temperantia tibi cometes.,,,,,2024-06-13T19:24:03.339Z,repost:fb129b92-55a8-4196-a561-bf82e3929fae,user:efe41fc2-c375-40f9-a96c-df80ff667c7a
repost:0cd2c370-77d4-4224-9a79-817c056e2e9e,Accedo defessus cicuta clarus earum.,,,,,2024-04-16T17:40:00.019Z,post:9ff62582-c200-4c2c-a270-3bb58245ffaf,user:348d6d86-30b0-4649-9905-039ae678839e
repost:12dcf3c7-ef91-4c3f-8142-3f99530386e0,Ventito ipsam alius nemo umquam calcar argumentum vetus.,,,,,2024-06-07T16:51:01.134Z,repost:347a8bb0-5821-4d63-a419-f01d53c2b878,user:c642b8bc-82ce-4c5a-b0b0-1001aebcac1a
repost:b950c73a-5961-47bf-866e-e46f62f48a7b,Temporibus pel termes curvo utor uberrime vinculum.,,,,,2023-10-09T10:01:42.779Z,post:4b0d4203-babf-4273-a942-40bc13965395,user:d5cf07ca-8586-4eea-b410-5a3df8d31793
repost:4d5b11ae-fac3-472a-953e-550517c2739c,Vinculum utor viridis comprehendo quas vulgivagus.,,,,,2024-03-29T05:19:34.152Z,repost:8433fd2d-23be-401a-83b1-cc0380098231,user:11fa7d69-dc43-4d98-9573-d2e1f15580a7
repost:0ceb27e5-003a-4c1a-94a7-bdb8e8d61cf1,Cena tametsi valde adulescens vallum theologus iste ustilo bos.,,,,,2023-10-27T08:26:41.673Z,post:178d50c3-38ae-43e1-bc51-1b04ecc0d0b7,user:20cbebaf-de32-4213-a0fb-ff25d8e53c40
repost:e7fb6c99-b182-4d46-83fa-d02deea9d00c,Vergo degusto degero calco stultus.,,,,,2024-02-01T22:41:06.433Z,post:640113c2-6d91-424c-a526-7c1c1f4d841b,user:f9287df0-dc52-4670-847f-f0c63d40bcb9
repost:649aeafc-9d4c-46de-b89b-1cb2556850fc,Sed claustrum tenuis atrocitas consequatur turbo.,,,,,2024-05-06T14:53:52.745Z,repost:bbe90478-1aa7-4b86-aece-4043129a4b14,user:2218e34e-bdcc-40f0-90db-e3f0318c564c
post:80521ee5-a552-43df-8cb4-8d3b02007d27,Officia id tracto sto.,,https://loremflickr.com/640/480?lock=4888589341032448,https://ancient-bonsai.com,,2024-05-30T07:27:43.431Z,,user:81a22185-6536-4be4-a431-e51d3bc17cfe
post:e25abd92-8f7e-4ceb-991b-c4eec19b8232,Spoliatio corrumpo cibus verecundia tamdiu cicuta.,"Cauda ex cubo natus vivo ventito.
Demoror auxilium subiungo placeat depulso delicate admoneo. Tertius auditor possimus deinde laboriosam valetudo conatus ater.",,,,2023-10-08T18:51:02.159Z,,user:76742fac-803a-4fe4-88ae-3c2a03d6aba6
post:be809175-cf2c-42fa-9bef-600c18aa1f9b,Nihil aqua bonus cultellus coaegresco audacia vere acsi.,"Vespillo bene nobis consequuntur annus comes. Volup beatae appositus utroque adfero casso sit territo.
Accusamus peior vilicus blandior altus damno vado aqua caritas unde. Varius cena umbra. Volup vapulus aegrus argentum ventosus ocer.",,,,2024-04-22T01:21:06.741Z,,user:f5ee87ca-a581-440d-8b75-e8f180b30961
post:cff6521b-bd76-460c-879c-fdb23fcf973c,Sulum thermae optio.,,,,,2024-01-26T15:13:25.064Z,,user:f8089a1b-e6a5-4cb1-995e-226e9775318e
repost:8b28e258-5ed9-44c6-976a-b0089989fbd2,Dolorem antiquus combibo cariosus vulgus pauci rerum copiose dolorum stella.,,,,,2024-05-23T10:45:03.526Z,post:1b3ff54a-199a-44c2-a588-f1d90dc3ef1c,user:e291f927-64d4-47e8-9a89-89e27abb7aa5
repost:fe97a451-e3b7-4fa0-a35a-cd1fde4a8787,Vae acervus clibanus calco calco vespillo auxilium sopor verumtamen.,,,,,2024-07-28T16:55:55.805Z,post:5ec8b313-b7a6-4b48-804f-b0231915c9e4,user:775941cb-d920-46a2-b12f-86d1c89f38f1
repost:f940bcf2-9d8a-4425-a617-f6dc9d417eb0,Careo casso speculum concedo suscipit tenetur.,,,,,2024-01-17T17:43:41.488Z,post:16985935-e67c-47c3-99ea-cd91ab160e6d,user:2cd09070-963c-4fba-a1dd-9ae0c43f69db
repost:0fbf323d-7c3f-4456-9ad1-db324cce3fe1,Expedita ipsa minima.,,,,,2023-10-09T12:27:35.528Z,repost:76b35ef9-d2e2-4044-a09d-150aecbbdcfa,user:3550c9d0-47c3-42f5-b294-da35064e074b
repost:f71fbc8a-f32a-4134-bef0-aa53dbeefd73,Tabgo comedo tantillus cunae utilis.,,,,,2024-07-30T12:52:44.944Z,repost:8f6b58f1-4b56-4da5-87e6-db24ad232ab9,user:603b18cc-48ef-46cc-beba-30ebdb000dd4
repost:6aa46ec4-5f30-429d-b6fb-2f35a87e1b4c,Amita repellat tres dolor arto.,,,,,2024-03-12T12:15:03.054Z,repost:9adc581c-6db9-48a6-b851-320ae8da2371,user:bcc39bc1-52af-4029-9798-489170872aed
post:df257bdd-13da-4924-a3aa-2502e8c068d4,Similique currus utpote thorax.,"Tripudio ocer thymbra ver vicissitudo aut crustulum distinctio adopto. Bibo sonitus vereor nulla carpo cui cohibeo uredo.
Deripio conatus demonstro avarus admitto. Chirographum consectetur sonitus quidem absens.",https://loremflickr.com/640/480?lock=4280157103718400,https://rotating-street.info,👨🏾‍✈️,2024-02-26T02:46:03.860Z,,user:a11347bb-d8fd-4985-8324-b90849837bc9
repost:54edd8d5-98d3-4d01-9fec-6e412d31cde5,Sunt usque delinquo.,,,,,2024-05-29T02:41:43.159Z,repost:07281498-086a-4409-9fdf-5892684ffb25,user:efe41fc2-c375-40f9-a96c-df80ff667c7a
post:109b772a-cd2e-443c-bfe8-7c3f8e86ac2d,Trado crinis defero pecto aegrotatio.,,,,,2024-02-15T17:04:30.055Z,,user:80f4e8b4-d075-459e-b3c7-931ee639d51b
repost:944f6e62-0b00-4c48-aa77-9948f8c1ba32,Defungo viridis absens cotidie.,,,,,2023-10-21T17:02:48.516Z,post:c04cbade-427c-4298-848b-2945030909a9,user:4a8ffb80-32a1-4232-8067-01b57c466871
repost:e757fce2-ab54-46f1-9b97-f01e3342de9b,Corroboro alveus acsi.,,,,,2024-01-18T01:18:08.118Z,repost:629fe29f-558d-4202-8c10-dc2bb9db87d1,user:bda76fa7-0723-4133-a4bc-7771fd61006c
repost:8cebb18b-6203-4390-9ed8-b3e21a92afc1,Valens ulterius adulescens aeternus consequatur accusamus.,,,,,2024-03-03T08:57:33.172Z,post:5de89282-fb5a-46ec-b522-042a52ac58f0,user:5a482623-fa9c-40a2-9205-fb87944cee90
repost:7268bf26-3bce-43b8-8ec3-ce1d93c51f9a,Magni careo harum cibus harum verecundia adipisci.,,,,,2023-10-15T01:03:04.263Z,repost:e86c66b7-868b-4f5d-b72b-d8582b3504f2,user:4bb722af-4b6d-4417-a85c-f5bba299a69a
repost:5b536001-b28c-4a46-9c9f-1b9883b69e18,Celebrer accusamus repellendus theatrum solum commodo abscido.,,,,,2024-01-27T23:02:16.565Z,post:4d82b506-bcc0-474d-b0b2-52bbfee8c82a,user:7191e034-c822-4350-9ee6-58c21c949306
repost:e4153186-65a6-4d4d-87b9-ec61ed775e3e,Tondeo rem universe delicate.,,,,,2024-01-27T01:46:01.723Z,post:e36f7482-639f-4a18-9580-4c69c5aed602,user:9e64b9ac-52d3-49ce-9b8b-41f6be0e67ed
repost:636870fc-c2dc-4107-97f9-7aa17d23dd47,Tenetur valeo teneo autus aptus debilito.,,,,,2024-03-27T04:02:49.151Z,repost:5b2cf597-d0b1-4e3d-a3a2-6bdb12af6352,user:348d6d86-30b0-4649-9905-039ae678839e
repost:d67c1f18-752f-4569-8218-76e53ede01ed,Tracto sortitus ante decet commodo.,,,,,2024-04-25T09:34:33.248Z,post:16985935-e67c-47c3-99ea-cd91ab160e6d,user:0a081d17-f6ad-4bad-a8c9-2d2a8fd99d6b
repost:97552d93-c3d6-46b6-905c-a1dde886f92a,Copiose vulgus aliqua uberrime denique carus sum conitor acies ullam.,,,,,2024-04-11T04:19:02.362Z,repost:5dbe70a2-8d0c-4bfe-b1e2-1d674c46dbae,user:a902c6f5-f474-42a0-99ff-7c3df01fa32b
repost:96b2113d-0a59-4086-b2b0-9339da509437,Votum votum vado cauda vestrum agnosco avarus.,,,,,2024-01-23T12:20:07.198Z,repost:75ab2e2c-741f-4997-97a1-51fa03d9e36a,user:dcb57509-1e32-4340-8f1d-db90af7d4e86
repost:7e7c05b5-4464-47df-bc90-66a57dadf8d6,Accusamus patria advenio peccatus temporibus audacia.,,,,,2023-12-10T06:45:37.709Z,post:206f773c-adb5-4c8d-a0f3-de1f3417c42a,user:7191e034-c822-4350-9ee6-58c21c949306
repost:c0003baa-6fb2-44be-b693-93a1a93654b7,Taceo virtus calamitas adaugeo concido.,,,,,2023-11-14T15:56:57.032Z,repost:758c86b4-6473-401f-a373-b465bfbdac6f,user:20e7cd89-608e-4e95-902d-4e7712ec52ad
repost:ecd90489-6847-4bde-bc24-ff6018a0d1cc,Cito terra occaecati arx suscipit corona.,,,,,2024-07-10T18:31:27.736Z,repost:75fbbefd-3e24-49ec-8233-fdd9b7c0c205,user:895cc69c-50d7-413d-900a-01babcafcf5c
post:64394b4e-4c1b-46d5-8aa3-e0640eead076,Commodi trans crastinus ultra bardus.,,,,🎗️,2024-06-08T19:38:48.934Z,,user:d2caffa9-2300-4a5f-aa9f-bbe7aadb37f3
post:c61a6a90-537b-49f3-83b5-0d3b3168c709,Tonsor via minus una ipsam casus recusandae tutis defero.,"Aro caelestis vacuus tenax. Verus aperte colligo sperno vivo debilito.
Mollitia demoror acerbitas tracto acsi contego deorsum. Maxime tollo correptius aegre derelinquo tabgo. Molestias dens decumbo textor voluptatibus stips.",,,,2023-09-12T22:52:41.858Z,,user:8a4e3f6c-a956-4ee0-9e69-d41ecfa4e486
post:0a536e96-15c6-4ac7-ac7c-071aa3464a00,Apostolus conitor aestivus dolores vindico crinis.,"Pariatur suffragium unus. Averto deleniti vivo solvo cometes cinis necessitatibus cupio compello.
Villa calculus fugit basium accommodo sonitus nihil. Non cura cernuus defaeco absens vulgaris corrigo sophismata.",,,,2024-04-10T06:38:12.124Z,,user:3ced374d-9745-4303-8ca7-45c19f8f25e4
repost:c909d97c-2ee8-48f6-9b66-c6452cad648a,Deludo uberrime aliqua.,,,,,2024-06-11T01:03:06.404Z,repost:5a585ec5-59b6-4d1c-98b0-d157ae8bb241,user:484858f8-1fa5-4d9b-a760-11e3914a5ee6
repost:d971cbd0-675e-4105-bf50-889fe68525e0,Accendo casus vindico anser.,,,,,2023-09-07T20:56:56.494Z,post:1265b42b-aef4-441f-9d46-bacc00d676f3,user:72d941ca-44e6-40ce-8e0e-5bd8eb221da6
repost:47e52a8d-bb00-41f5-8344-e4f278b7417e,Clam demonstro sodalitas incidunt alveus vomito facere adinventitias averto.,,,,,2023-11-09T20:00:44.490Z,post:d91a2733-76f4-490c-b190-fd5a140d972f,user:c0593fb7-940f-4bed-b8a9-19c245b82543
repost:d1e78501-7975-4b7e-9dd5-c1fe29ba5b26,Denego est verbera rerum confido sum.,,,,,2024-07-12T10:49:52.287Z,repost:07c14220-6c41-4774-a258-5839b2c1522e,user:fdc038d9-0a06-4aee-a3d1-b64241186a33
repost:d55f78ba-f8c1-46fa-ba71-fb3222e409a4,Vitium calculus dolores damnatio sopor neque et statua.,,,,,2023-08-28T17:42:09.359Z,repost:b67aa99b-4c40-4f68-a795-ac330cb0e35f,user:74c609cb-a157-48e5-b9b4-13223f874ac6
repost:0e347ff0-5c3e-4b50-9494-0f1f67b042c7,Deporto vae talus suspendo dolorum ambulo arca.,,,,,2023-09-11T09:49:49.596Z,repost:7c7b85d4-426d-4404-b084-970fac012e4f,user:0989c27a-f400-4d30-84e4-32b563abc0ae
repost:d97dfefd-8b63-44a5-b66a-4693516852ea,Appono conturbo contabesco spiculum temperantia tutis decor comprehendo.,,,,,2023-09-11T14:14:27.707Z,repost:4cdd7c4e-7547-4777-8942-b6752f677b12,user:4eebebf6-d42f-4316-9f37-2a68dbe719c0
repost:f19e2f2e-b90f-4594-a271-fc508ce99685,Thalassinus cavus theatrum.,,,,,2024-04-21T14:50:51.061Z,post:e3f3fd2f-7062-4bcc-a13c-b5144fdc463c,user:4a8ffb80-32a1-4232-8067-01b57c466871
repost:b91178f2-1373-406a-9e22-52a62d4a948e,Synagoga illo modi accendo appositus corrumpo aiunt.,,,,,2023-09-23T12:47:43.275Z,repost:01db2239-e27a-402f-9a19-c787e629743b,user:bbe0ea5e-4163-4f80-81b1-beb732cbe786
repost:8a03197a-9c9b-476c-b761-fdd9452ccdb2,Sono alo aqua virga corrupti.,,,,,2024-02-07T11:37:47.786Z,repost:7054291e-692e-4426-86bf-49e5f178eb68,user:3119fde2-38d6-4605-a947-c69fb191a1ec
repost:8968e6d8-560f-4aa2-afc2-7c452a376417,Explicabo aduro defetiscor atque.,,,,,2024-04-21T07:22:22.756Z,post:d8eb8964-2fc3-4756-9627-390320317827,user:fdc038d9-0a06-4aee-a3d1-b64241186a33
repost:33464047-9f15-4a87-8bff-47c2428e96cc,Illum at torqueo in.,,,,,2023-09-12T03:37:58.973Z,post:c3dca92a-a2d0-456e-a608-d69b9d167f18,user:09921475-d286-4bb4-b46b-25100b0d9f42
repost:71abb727-377e-42c3-a7b2-dbc2626fd8e2,Dedecor vicinus deinde.,,,,,2024-05-18T00:48:49.517Z,post:8f442518-44fb-4cc6-bebd-2af75205195b,user:0b4d3b0a-7580-42a4-bb62-bcbe1665f00b
post:58cc5e89-5f95-4dac-b90c-f1f4cecd6252,Avaritia conforto suadeo suus beatus culpo totidem.,,,,,2023-09-12T21:34:25.235Z,,user:f7e95dd6-2692-433d-a3ce-06a41c68b99e
repost:13f82cca-2069-49c2-a820-c207c1433bba,Tutis caelestis vestigium cervus vorago vado decimus adimpleo aurum.,,,,,2024-02-12T14:55:59.494Z,repost:e6db5205-74ef-494d-aa7e-c88dabccdedc,user:baf2736b-8203-4611-a213-4215988bcbfd
post:7a0ddef6-55bd-4e54-9e9c-68614b3c86af,Umbra defungo beneficium altus architecto alter.,"Delectus depromo decor maxime demum confero attollo viridis.
Aliquam angustus admiratio. Curatio abeo labore fugiat sint tardus.",,https://soft-pleasure.biz,,2024-02-19T14:07:37.378Z,,user:3466f4ce-2dd7-491e-a54a-5d4b7a942ac8
repost:e1d1514b-91c6-414d-b8dc-4f7b195078b8,Vulnero cornu saepe somnus.,,,,,2023-11-28T00:48:36.281Z,repost:5bbb9177-1eaa-4397-8ae0-a794767c03ad,user:e92e9cde-cb89-4600-aed1-fcd96d00e370
repost:82558c46-75b5-43f2-ac26-24b938e90a89,Tracto amet aestus vulgo cernuus valde desipio officiis decet cariosus.,,,,,2023-12-07T13:33:59.855Z,post:f0e2f8f3-d2db-4165-8c8f-2c761b3f7cf4,user:0a081d17-f6ad-4bad-a8c9-2d2a8fd99d6b
post:87bdbc73-f551-47f9-bd2b-a39e8d0215ae,Tumultus terebro averto creta vacuus acidus commemoro constans.,"Conculco utroque argentum comminor contego tantum constans.
Decretum contego despecto tero stabilis baiulus acidus valde. Capto fugit audeo territo uterque adhuc derelinquo charisma titulus. Molestiae carcer acer.",,,,2024-05-19T08:13:40.416Z,,user:5f180356-9017-4066-9301-ed55bfad0a01
repost:c3ebfd80-b33d-4304-bcae-a52e3590d451,Voro tum cura.,,,,,2024-01-24T21:27:07.200Z,repost:ed68f6c9-0a9f-4e68-8049-123445aed6ae,user:9e64b9ac-52d3-49ce-9b8b-41f6be0e67ed
post:cc08b1f3-0985-4254-986b-a16a16bbd73f,Dicta quibusdam solitudo aestivus avaritia.,,,https://discrete-shorts.org/,,2023-09-10T15:56:09.562Z,,user:5299b7f6-fb44-4aa0-9763-a5d115f555a7
post:37eb1ef6-8578-46f3-90db-76c4bade0d94,Supellex repudiandae utilis cunctatio venia conservo.,"Sustineo cumque armarium condico dapifer.
Cimentarius speciosus clarus uxor arbitro damnatio.",https://loremflickr.com/640/480?lock=2160609806254080,,🎊,2024-06-25T19:55:14.238Z,,user:b8e89104-6799-4ee6-bcd5-33d88c3266dd
post:3c6fa007-8c39-48e9-a678-526204d25d98,Vesper tergo desipio cubitum amitto tutis tracto.,"Utilis pauci pel maiores ocer tenetur blandior.
Adsuesco votum carmen truculenter vindico demergo vulnero aro corona deprimo. Ager decerno pecco varius cogo. Velum vigilo ancilla.",,,,2024-04-02T06:57:06.492Z,,user:1c0e1a49-3242-4037-9719-d53346973499
repost:b7a4d49a-d96b-497a-8b34-daf0b602729f,Clarus volutabrum suasoria.,,,,,2023-12-13T00:49:25.477Z,repost:2759fed1-c1d3-42cf-9773-c0f2cddd8217,user:0e1b88f2-e06c-413b-aa68-efb1f9f22954
post:483c2427-e2a4-4b16-899d-09be6cf7a338,Tollo talus animi maxime denuncio caritas ars decens.,,https://loremflickr.com/640/480?lock=1938424535711744,,🚖,2023-11-03T23:15:23.290Z,,user:d62c88a2-a93a-48df-a5b9-15de7ce3e659
repost:985560f7-652e-4518-afcd-d1c0f56dee94,Casus corrumpo necessitatibus bellum officiis contego.,,,,,2023-12-14T10:06:10.049Z,repost:323347cd-dea2-4aa3-a3e4-63b2918e46ca,user:6f768309-58ef-495b-b484-bf720334c452
repost:2d29d20f-191e-488e-a4a6-b6df144d7c55,Suffoco currus depromo vel civis capio aureus ver.,,,,,2023-09-11T12:45:12.927Z,repost:99c9de58-e5f5-4576-bb69-4f1f19629212,user:3fcd0a7a-e9b4-47e0-81a3-5ce02ca6f56d
post:abbc3b24-b35e-43a5-8b78-5d2b02a75394,Colo stillicidium talus utilis desipio astrum atrocitas umquam testimonium utrimque.,,,,,2024-08-16T03:45:48.570Z,,user:a03c6d1a-f934-4b49-91e0-abaffdec19f2
post:6f95ebad-fa61-41e3-912b-5dcca88fa568,Repellat utrum cursim quia cribro.,"Antiquus apud saepe auditor tenuis iste thesis communis amaritudo velociter. Molestias accedo aestivus usus vitium sursum apparatus. Validus praesentium creta.
Contra conspergo cui cognatus.",,,,2023-09-15T20:08:15.963Z,,user:7d4ae08d-f634-424f-94bc-0026400962c2
post:b71048d6-50a3-4a64-922f-b97f7604b746,Volubilis acsi ceno.,"Subnecto vomica thymum vulariter vergo. Averto admoveo aspicio amoveo pectus.
Terra aedificium acies compello vester terror consequuntur cohors demitto abstergo. Utique aurum eum quam chirographum desidero ceno asperiores. Accendo accusantium tantillus varius beatae quia.",https://loremflickr.com/640/480?lock=5093525093875712,,👐🏻,2024-02-10T02:01:03.506Z,,user:d62c88a2-a93a-48df-a5b9-15de7ce3e659
post:5c5c7c86-d78f-4041-b6cb-b9628df33837,Spiritus accusator inventore alienus stillicidium.,,,,♿,2023-11-12T07:20:27.711Z,,user:a11347bb-d8fd-4985-8324-b90849837bc9
post:7107fad4-9099-4d7c-8ed0-c56655c9ad82,Dignissimos aegrus comes tricesimus caveo decretum.,"Caterva umquam terror sollicito aeger bestia. Cuius credo eos ultio certe ars vehemens sulum ait. Vehemens repellat corrigo amita saepe deputo vulariter comis amoveo taceo.
Toties termes tempora vester acervus trepide. Caterva accendo templum vir animi abundans corrumpo vobis.",https://loremflickr.com/640/480?lock=7987407712419840,https://big-bookend.biz,,2023-09-27T16:52:09.673Z,,user:847aef53-8e28-448a-8857-4f1fbb1e1d8e
repost:236d5ae3-35fb-4dc6-bfb4-5fd571ae998f,Uberrime coma pel aspernatur terreo deprecator abutor surgo expedita.,,,,,2023-10-29T07:41:03.916Z,repost:d6b509f4-70c1-4f7a-b1dd-2f54c5fb0702,user:4bb722af-4b6d-4417-a85c-f5bba299a69a
