id,headline,body,image,link,emoji,created_at,repost,author
post:9114a6a3-7487-44cf-99cd-15935971dbb1,Talio tolero cubitum bis curia.,,,https://impressionable-arcade.com,,2023-10-30T11:29:13.449Z,,user:09921475-d286-4bb4-b46b-25100b0d9f42
repost:fd22dd81-87ea-4336-930a-b2dee5b56839,Coniuratio claudeo desparatus.,,,,,2024-06-25T08:25:29.522Z,post:9114a6a3-7487-44cf-99cd-15935971dbb1,user:1a1ba939-cae6-44ed-bd11-1a786e3ec32d
post:4bce23a2-b50c-4803-b516-fb472466cba5,Magni architecto necessitatibus conventus defaeco quibusdam.,"Praesentium cultellus vapulus conatus administratio fugit contigo tribuo laudantium amita.
Argumentum aptus beatae audax tametsi. Venustas carmen solium tribuo cuppedia. Volubilis arcus aiunt supra.",,,🐭,2024-06-14T05:58:46.181Z,,user:f6e9b6a1-feae-4e63-a021-d075acef5cad
post:659e1c74-f8af-4b39-b97f-3d14fa7d0822,Armarium tenetur deripio iusto.,"Repudiandae veniam tantum urbanus tego carus cur civitas artificiose. Contabesco ago ultra cohaero arto abduco absque caritas.
Abeo comis spoliatio talio.",,,💛,2024-03-29T09:32:39.283Z,,user:475e602b-fdea-4db3-9469-7c5fc0086eba
repost:8d0471e5-597a-4f92-93b2-905691742e49,Sui admiratio tero.,,,,,2024-01-04T19:58:03.708Z,post:4bce23a2-b50c-4803-b516-fb472466cba5,user:56bfe5ce-301c-486f-947d-dee6e97dc0bd
repost:7dfbf88a-b544-46b2-ae47-ccf65c65a5c9,Accommodo brevis summisse eum volubilis catena accommodo demergo sufficio sint.,,,,,2024-04-06T20:23:22.488Z,repost:fd22dd81-87ea-4336-930a-b2dee5b56839,user:85625e6d-c20a-479e-9787-b52d1810f311
repost:5ab97690-28d1-4593-a9c4-d4dcd79f40d1,Pauper at patria comminor quam volubilis circumvenio pel sto.,,,,,2023-09-05T20:31:59.380Z,post:9114a6a3-7487-44cf-99cd-15935971dbb1,user:7191e034-c822-4350-9ee6-58c21c949306
post:e3f3fd2f-7062-4bcc-a13c-b5144fdc463c,Avarus valeo stella arceo theatrum crastinus.,,,https://unsteady-stinger.org,,2023-12-17T01:57:44.476Z,,user:733a0e4d-9e5e-4f77-a6d6-f739427b883c
post:bfbd911f-5425-4172-a2c9-65dce4ffa764,Crudelis xiphias perferendis.,,,,,2023-10-25T11:51:48.732Z,,user:ff7f9adf-0f1c-4787-af62-19ca1e22d900
post:f0e2f8f3-d2db-4165-8c8f-2c761b3f7cf4,Tonsor eum admoveo tabernus cinis tamisium barba vae tutamen.,"Aequus sollers decet. Turba depromo cruentus creo. Vapulus nobis exercitationem ab suggero valde commodo utique claudeo cibus.
Tametsi neque curvo amplitudo vereor.",,,,2024-05-28T20:38:29.276Z,,user:7a4a022a-c2c6-4da3-94c9-399e1c8ae655
post:ef01b9b3-7aa3-45b5-a141-0a71c01f4985,Charisma ceno valens tergiversatio decipio.,"Accommodo arbitro tricesimus despecto tenetur antiquus solutio contra bestia. Viriliter coerceo tener altus defessus verus perferendis adficio. Venia vitiosus paulatim capio conicio comes vero depopulo verus.
Apto vae vilis arbustum surculus. Audio ventito adhuc sursum sollers apparatus despecto quibusdam. Calculus amplitudo talus cito suus decor aranea unde cauda.",,,,2023-09-03T08:05:24.110Z,,user:3119fde2-38d6-4605-a947-c69fb191a1ec
repost:8d5bd320-b590-4cb1-8bd8-64d00adfb291,Agnosco aurum strenuus arguo bellum concedo eum vespillo accusantium vae.,,,,,2024-06-03T23:09:57.034Z,post:ef01b9b3-7aa3-45b5-a141-0a71c01f4985,user:a962f856-ee18-4228-bbb5-2347fe86229d
repost:2759fed1-c1d3-42cf-9773-c0f2cddd8217,Et cultura tredecim conservo vulgo officiis degenero.,,,,,2023-09-14T00:50:57.939Z,post:9114a6a3-7487-44cf-99cd-15935971dbb1,user:37faa4ee-aea6-4cae-af6a-32b71a93e1fe
repost:486c2e74-06f0-4a66-8306-d472434ebb8e,Accommodo aegre vel aperte.,,,,,2024-07-30T06:50:07.835Z,repost:8d5bd320-b590-4cb1-8bd8-64d00adfb291,user:f68cefd3-71bf-4afa-ab81-e19b6741f156
repost:76b35ef9-d2e2-4044-a09d-150aecbbdcfa,Corrumpo cotidie vivo aeger adeo odit cetera terra.,,,,,2024-01-18T05:45:26.834Z,post:e3f3fd2f-7062-4bcc-a13c-b5144fdc463c,user:7d4ae08d-f634-424f-94bc-0026400962c2
repost:652b03c7-17e9-48b2-9598-84ca7bce2d7f,Sustineo cetera provident.,,,,,2023-12-23T13:35:23.173Z,repost:8d5bd320-b590-4cb1-8bd8-64d00adfb291,user:de479821-e148-4834-877d-8261a2c1d71c
post:e751ee70-0d05-434f-9e3f-62fff432b977,Pecco tabella conscendo conor adimpleo tutis asperiores deduco.,"Vel vallum suffragium aestas spargo saepe magni tutis facere ait.
Varius viduo defendo conduco pauper distinctio. Altus amoveo varius. Demens vespillo cauda aduro depereo.",https://loremflickr.com/640/480?lock=3092845382598656,,⛰️,2024-07-10T22:28:26.301Z,,user:8de7b460-884f-4bef-a05f-b09def94307c
post:0b564d6e-a8f8-4a57-80ff-2833b059402f,Abscido tandem aeternus voluptatum vobis usitas.,,,,,2023-09-14T14:23:14.733Z,,user:3bdfe7dd-9a57-498d-a24e-fe2ed3c789ca
post:a7cd33b3-e8e6-4904-bb13-5761f0c4da9d,Adinventitias vero ante tibi consequuntur fugiat eaque verumtamen torrens timor.,"Spes minima antiquus appono turbo trucido stips speciosus. Cattus virga bibo volva accedo. Viridis ulciscor ratione audacia auctus curriculum supra sodalitas beneficium.
Cum absens volutabrum earum coniecto dedecor expedita cicuta asperiores versus.",https://loremflickr.com/640/480?lock=432442146029568,,😫,2023-10-22T19:57:08.966Z,,user:484858f8-1fa5-4d9b-a760-11e3914a5ee6
post:0fb4e48b-1836-45d9-a1b9-25685ac8cfb9,Aptus pariatur impedit tantillus.,,,,,2023-12-08T18:14:18.511Z,,user:74c609cb-a157-48e5-b9b4-13223f874ac6
post:c72640f1-4d80-4441-8d1c-ee96f69e269e,Vilis cultellus ambulo ocer antepono congregatio celer benigne totidem.,"Custodia supplanto usus sint tertius dicta. Trucido coruscus adulescens bonus sunt absconditus doloribus vestigium usus creptio.
Aer argentum demoror voluptates. Decumbo careo tero corrigo vinum vitae cum auxilium thorax arguo.",,,🇱🇾,2023-10-08T08:35:02.717Z,,user:a48ca412-e522-481a-b879-032fc7b12f60
repost:dd066ab2-053f-4ada-bc36-df53b7a02f56,Repellendus cervus sunt dolores unus commemoro.,,,,,2024-07-10T17:48:11.009Z,post:e3f3fd2f-7062-4bcc-a13c-b5144fdc463c,user:cce5d540-2683-4e5c-9b05-2e0b0e916569
repost:0fba2357-007e-4369-8f77-11dfa58817a9,Atqui deputo reprehenderit caelestis adiuvo quod fuga stipes.,,,,,2024-08-11T22:39:37.674Z,post:a7cd33b3-e8e6-4904-bb13-5761f0c4da9d,user:9eefbc81-12f1-42b8-b529-0a9428a5b92e
post:87812ea4-5918-428b-b91d-8d353251db4e,Tabesco casus sub assumenda colligo aggero nobis sequi.,"Tenus viduo inventore iste ad.
Stips crapula tempus tondeo voveo adipisci amissio pecus aurum tumultus. Aro carcer suscipit stultus. Utrimque suscipit absconditus quidem ex deleniti.",https://loremflickr.com/640/480?lock=3394907339227136,https://bleak-awareness.biz,🦌,2024-03-29T12:46:34.195Z,,user:09921475-d286-4bb4-b46b-25100b0d9f42
repost:48176d8e-2420-47ea-9900-05a1c0c391f6,Hic absorbeo terror canis.,,,,,2023-12-29T06:37:08.034Z,post:ef01b9b3-7aa3-45b5-a141-0a71c01f4985,user:7bd66ff6-cde2-487b-9a7a-f2d8c6ce7e9b
post:1969bd94-b9ff-4529-a052-2cf963eb6a70,Benigne enim ciminatio labore curtus tendo.,"Utor traho delectatio conscendo ademptio sunt volo. Urbanus spoliatio tricesimus.
Voluptatum decerno verto clarus suggero cicuta ullus.",,,,2023-11-20T18:32:07.461Z,,user:341d1b8c-9333-4f2d-9e24-020a11665528
post:e68547e0-b05e-4a0a-a9ee-a433c5eeab6f,Aetas appello allatus tyrannus cedo.,"Canis derideo sequi bibo vel deporto vos stipes demergo aperio.
Cometes cornu talio congregatio iusto decet sapiente victoria.",,,,2023-12-17T10:38:01.696Z,,user:aa54cd82-7fc9-4dae-9ed6-6d36c3829d21
repost:c661ef59-c26f-4f9c-8482-a21b061c68b6,Veritatis ventus urbs.,,,,,2024-03-07T14:19:04.157Z,repost:652b03c7-17e9-48b2-9598-84ca7bce2d7f,user:a902c6f5-f474-42a0-99ff-7c3df01fa32b
repost:53c82957-d3ca-46c1-8ce9-1d9aaf65fd9e,Universe derelinquo vester assumenda uberrime provident validus delinquo attollo.,,,,,2023-10-12T10:53:18.618Z,post:e751ee70-0d05-434f-9e3f-62fff432b977,user:acba9a2a-a6d7-486b-a453-351a047281ea
post:5843a8a3-bd2e-4d9c-ad2c-e1519f573683,Voro patria terminatio repellat vir atrocitas bene attonbitus termes expedita.,"Ambulo repudiandae vociferor aureus alienus arbitro conspergo capillus tutis cetera.
Ventosus timor via.",,,,2023-10-26T14:02:01.150Z,,user:74a06a66-9a4f-440c-bb96-67f812026b74
post:a17d6289-5946-454c-b98c-8b6afa2a92ee,Consequatur cibo ater cribro aliqua substantia acer.,"Antepono amet pariatur. Sollicito tunc coadunatio vacuus absorbeo timor thesaurus.
Maiores bene abscido cohors eligendi tabula thymbra baiulus demo. Considero considero ventus.",https://loremflickr.com/640/480?lock=6862088649572352,,,2024-05-26T22:54:24.901Z,,user:3f7756c7-694e-4e1e-9440-8499c1d1e0f7
post:1b3ff54a-199a-44c2-a588-f1d90dc3ef1c,Suppono absconditus eveniet vitae adamo atque.,,,https://offensive-federation.info,👉🏻,2023-12-29T19:10:34.898Z,,user:bbe0ea5e-4163-4f80-81b1-beb732cbe786
post:d56c517e-f2ca-4dd5-bc19-eed2746900df,Universe perspiciatis supplanto.,,,https://extra-small-leopard.name/,🍯,2024-08-07T00:17:42.728Z,,user:99677da3-dd44-4ebc-8bed-fdf1d243334d
repost:d62a349a-5d5b-423f-ac4d-446682e93a2a,Dapifer expedita crebro.,,,,,2024-07-10T13:50:10.556Z,repost:0fba2357-007e-4369-8f77-11dfa58817a9,user:2af5ad94-5c20-486f-a434-bbcac84075de
post:23b2a10d-4cc5-46f5-bfd1-920021bb5281,Congregatio quasi conor.,,,https://superior-theater.com/,🎣,2024-08-05T06:25:26.334Z,,user:96501074-22f7-4979-ba91-665acae1419c
post:4e0ac679-9093-415c-98c3-a6e91f5aa305,Temeritas error corrupti deorsum earum argumentum tenetur.,"Vallum adversus uxor comprehendo uberrime tertius assumenda. Cibo eius reiciendis curtus chirographum veritatis demum hic tener.
Casus crinis veritatis sophismata calamitas candidus censura amiculum subseco torqueo.",https://loremflickr.com/640/480?lock=3079089642536960,,👇🏽,2024-02-18T15:55:18.050Z,,user:84bf8f4c-4b42-4830-8bcf-ef017c6e5547
repost:fbfaa43d-136f-42c5-9541-10de906641e3,Incidunt quod desparatus.,,,,,2023-11-04T04:48:15.651Z,post:e68547e0-b05e-4a0a-a9ee-a433c5eeab6f,user:99677da3-dd44-4ebc-8bed-fdf1d243334d
post:f10461fc-4a69-42a9-a71a-9f11f7c929e3,Pecto summa compono sumo balbus.,"Cogito texo terra abutor. Antea arbitro cuius necessitatibus decretum denuncio acquiro textilis accendo. Confero degusto decet solium vetus creber vobis.
Tremo vis solio tabernus vigilo creber averto crustulum iusto.",https://loremflickr.com/640/480?lock=3842466717368320,,🪗,2023-12-11T01:06:45.867Z,,user:a11347bb-d8fd-4985-8324-b90849837bc9
post:4b0d4203-babf-4273-a942-40bc13965395,Cuius stips ubi.,,,,,2024-02-05T14:51:55.101Z,,user:12b79968-08fe-407b-bd80-96eff40b58b8
post:28454fef-799e-4194-a595-7b4270d60906,Voluptate aperte victoria harum velum abduco caelum ago.,"Apto libero architecto. Cubo traho tutis clementia exercitationem recusandae.
Varius peccatus vallum utpote strenuus vinitor accedo. Degero sui validus administratio adversus voluptates torrens sit. Aspicio corpus conscendo.",https://loremflickr.com/640/480?lock=2551308758286336,https://worthless-art.name,⏯️,2024-01-06T22:35:18.131Z,,user:4a8ffb80-32a1-4232-8067-01b57c466871
repost:2c73e226-1c10-4757-ad9b-825543253e27,Terebro umerus sulum creo.,,,,,2024-05-30T04:00:33.148Z,repost:2759fed1-c1d3-42cf-9773-c0f2cddd8217,user:9de2486e-e03e-48dc-bb7c-bada05a12312
repost:7c7b85d4-426d-4404-b084-970fac012e4f,Viridis defleo sub crur vix.,,,,,2024-02-21T05:17:23.665Z,repost:8d0471e5-597a-4f92-93b2-905691742e49,user:baf2736b-8203-4611-a213-4215988bcbfd
repost:91359fba-1aa7-415b-a4fa-3934fe5eaf39,Crux corrigo eaque sui amo argentum.,,,,,2024-06-09T06:15:17.522Z,post:4e0ac679-9093-415c-98c3-a6e91f5aa305,user:578307f7-f11c-4ecf-a6aa-fdaa19883570
repost:06c15a7b-1cea-4eae-9a14-832c70040e90,Vado venio arguo adsidue cariosus asporto quo delinquo.,,,,,2024-03-23T04:12:22.924Z,repost:652b03c7-17e9-48b2-9598-84ca7bce2d7f,user:c0593fb7-940f-4bed-b8a9-19c245b82543
repost:bb2eb3b3-3083-4c19-825f-87f9946489d8,Avarus vehemens claustrum conitor cotidie.,,,,,2024-03-13T03:35:51.479Z,post:bfbd911f-5425-4172-a2c9-65dce4ffa764,user:cf673f1a-c723-41e3-a9bf-7968b95728fe
post:f6c60bde-b31a-48c6-9a69-8b00fc78d137,Currus vomer earum.,"Temptatio illo valeo attonbitus debilito.
Bellum deporto cibo turpis correptius abeo. Decet acervus caterva virtus denuo tantillus molestias. Atrocitas administratio texo.",,https://thick-icecream.com,,2023-12-27T06:17:52.010Z,,user:a45af038-fdb7-461d-8039-30c99df43661
repost:d8ddbb76-998c-4bb7-bebf-b46eeb252a27,Certe delego spiritus consuasor.,,,,,2024-04-02T21:42:19.909Z,post:28454fef-799e-4194-a595-7b4270d60906,user:67f7efe9-14e2-43b1-b404-941893da200c
repost:75fbbefd-3e24-49ec-8233-fdd9b7c0c205,Cado coaegresco deleo vorago una arguo versus adflicto succedo.,,,,,2024-06-12T09:14:26.445Z,post:e751ee70-0d05-434f-9e3f-62fff432b977,user:00bf5616-864f-4b1f-aeeb-90b2652c1bbf
post:0b4eed9d-b881-4dd4-9d54-b220d53178cd,Vester tendo vix adipisci approbo trado.,"Reprehenderit delinquo tabgo viridis subnecto sit.
Tunc condico deripio dolorem. Vulticulus accusamus colo cogito.",,https://realistic-tapioca.info,,2024-08-16T14:43:56.966Z,,user:74c609cb-a157-48e5-b9b4-13223f874ac6
repost:2b22a84c-1fc3-4155-80db-e63a88580ffc,Commodi statua voluptate.,,,,,2023-09-14T23:53:27.941Z,repost:0fba2357-007e-4369-8f77-11dfa58817a9,user:5a482623-fa9c-40a2-9205-fb87944cee90
repost:7d354bce-bf4b-4030-9baa-30c29d205b86,Subito capillus trepide triumphus.,,,,,2024-05-22T07:31:43.378Z,repost:8d0471e5-597a-4f92-93b2-905691742e49,user:895cc69c-50d7-413d-900a-01babcafcf5c
post:8863d2de-04f9-48e8-a68c-41eed695a41f,Doloribus repellendus amo considero uxor validus.,"Hic repudiandae subnecto.
Suspendo maxime cena ante tumultus. Delibero urbanus derideo ambitus. Curo collum centum veritatis vilicus ventosus.",,https://glossy-compensation.net/,,2024-05-15T04:17:05.647Z,,user:75e56396-b472-4e58-90b1-bba4e3510e42
repost:629fe29f-558d-4202-8c10-dc2bb9db87d1,Ustulo beatus apud possimus.,,,,,2023-11-21T10:14:11.101Z,post:0fb4e48b-1836-45d9-a1b9-25685ac8cfb9,user:68f3d146-d296-46a8-84c6-716f25397c7b
post:0f6bb894-a77b-4221-8865-b702a0978abc,Deporto aegrus quibusdam maxime volo ago non adicio.,,,https://helpless-suburb.name,,2024-01-24T01:28:48.630Z,,user:201a34a3-8b30-4553-a4b8-cfb6914f6f42
repost:621010d3-edb3-4270-8b0a-c6fd57b4bde2,Decens vestigium suscipio vilicus id.,,,,,2024-05-22T23:00:22.038Z,post:9114a6a3-7487-44cf-99cd-15935971dbb1,user:0b192284-fb34-4340-9c9d-fdde4b42f155
repost:dfa3f321-dc7f-42b2-b368-eed9b301b5b0,Civis vinco suscipit.,,,,,2024-06-16T06:35:16.095Z,repost:652b03c7-17e9-48b2-9598-84ca7bce2d7f,user:a962f856-ee18-4228-bbb5-2347fe86229d
repost:4f8f47b7-b5ec-4803-aed2-6fdf074360ed,Verus depulso aggredior.,,,,,2024-01-03T20:46:44.296Z,repost:486c2e74-06f0-4a66-8306-d472434ebb8e,user:1c79a862-839a-458c-9870-cd657f774899
post:17e367b7-a253-4b6d-89b5-d48a6328e37d,Delego casso capitulus pauper caste delectus.,"Valetudo coruscus valetudo desparatus. Chirographum bardus utrum accedo ab audentia adeptio. Voluptatem nam cubitum.
Temporibus volup thema cunctatio vito angustus ulterius vox.",,https://skeletal-acid.com/,,2023-10-10T22:46:44.354Z,,user:f99080a0-221d-4b29-8947-873b80bc3b3d
repost:e50125bb-be4c-4ca7-a365-d881b70d04fd,Tracto cariosus absque cetera magni vix cruentus.,,,,,2023-09-05T11:30:56.704Z,repost:2759fed1-c1d3-42cf-9773-c0f2cddd8217,user:5c5f8c99-178b-4270-bbc9-0a87ea6e099d
repost:f9d7d783-84c4-4e48-a916-feb673caf374,Cubicularis aliqua sol voluntarius infit velit attonbitus.,,,,,2024-08-23T09:15:01.841Z,post:9114a6a3-7487-44cf-99cd-15935971dbb1,user:00bf5616-864f-4b1f-aeeb-90b2652c1bbf
repost:676d0dbf-4cdd-40db-bad2-ee82c78eee98,Vivo sum taedium harum dolore tego.,,,,,2024-04-29T15:10:46.853Z,post:5843a8a3-bd2e-4d9c-ad2c-e1519f573683,user:80f4e8b4-d075-459e-b3c7-931ee639d51b
repost:5a585ec5-59b6-4d1c-98b0-d157ae8bb241,Somnus suscipit crustulum abundans valeo alias temptatio alius.,,,,,2024-07-20T07:44:58.674Z,post:c72640f1-4d80-4441-8d1c-ee96f69e269e,user:00bf5616-864f-4b1f-aeeb-90b2652c1bbf
repost:e7735847-11d5-4671-b482-a1abce8f2533,Consectetur venio acervus iusto decet talus animus deporto.,,,,,2023-10-11T16:19:31.750Z,repost:7c7b85d4-426d-4404-b084-970fac012e4f,user:99677da3-dd44-4ebc-8bed-fdf1d243334d
repost:d273972e-49b6-491f-b53d-c9e765d4462c,Solutio arguo vado.,,,,,2024-08-18T08:43:44.060Z,post:8863d2de-04f9-48e8-a68c-41eed695a41f,user:fc9f89f8-c018-46d5-9b7b-f86698d91c14
repost:19d2f019-a976-4bd2-afdd-910abefc56f5,Beatus vallum claro cultellus trucido alias tepidus.,,,,,2024-02-20T02:21:42.236Z,post:a17d6289-5946-454c-b98c-8b6afa2a92ee,user:f0828c6f-e36e-4bef-8f41-4a2efd4e0a80
repost:b71e206d-ea0b-42b9-ae9b-cfcd7a416a3f,Decumbo demo suffragium aperiam comedo cubo cito.,,,,,2023-11-20T13:32:07.010Z,post:28454fef-799e-4194-a595-7b4270d60906,user:c75b7477-a4fb-43f9-8dd4-5cec897d6503
post:c36f96b8-b86e-4afb-b00a-f57dcbb2be37,Vesco utrimque arbor comprehendo maxime eos.,,,,📧,2024-06-20T21:49:12.085Z,,user:37e47a9f-2fd5-41cc-ab9a-e4663a1cc640
post:3458811a-5372-4813-bcb5-11de5171d493,Perspiciatis dedecor dens abscido valens.,,,,🇲🇺,2023-11-13T14:49:12.422Z,,user:f68cefd3-71bf-4afa-ab81-e19b6741f156
repost:0dc41fd0-8e83-41a6-ba13-994ec703bc71,Claustrum antepono speculum amicitia defessus stabilis tumultus damnatio testimonium.,,,,,2024-03-18T15:50:49.867Z,repost:b71e206d-ea0b-42b9-ae9b-cfcd7a416a3f,user:847aef53-8e28-448a-8857-4f1fbb1e1d8e
repost:579df343-eb71-4a5a-b692-a50b96fac540,Aequus subnecto toties vulticulus triduana paulatim sint.,,,,,2024-02-16T12:18:00.193Z,repost:19d2f019-a976-4bd2-afdd-910abefc56f5,user:a962f856-ee18-4228-bbb5-2347fe86229d
post:c04cbade-427c-4298-848b-2945030909a9,Officia curso valetudo tumultus ab decens quam.,,https://loremflickr.com/640/480?lock=4563627044503552,,🦶🏻,2024-01-21T10:39:49.433Z,,user:847aef53-8e28-448a-8857-4f1fbb1e1d8e
post:a561a0e0-e9d8-4975-b073-9b32183a4f5e,Spargo appono valde volaticus alii vis ascit.,,,https://circular-fallacy.name/,🛂,2024-04-28T06:25:05.181Z,,user:6621116e-c933-46ca-8bdd-7ca437bafe06
repost:73b711dc-2192-4f28-a701-183d8a967c7b,Truculenter theatrum curia victoria tergum vestigium laboriosam adficio audeo uberrime.,,,,,2023-09-17T17:57:49.316Z,post:e68547e0-b05e-4a0a-a9ee-a433c5eeab6f,user:efe41fc2-c375-40f9-a96c-df80ff667c7a
post:2b2850a3-38c0-4c2d-b17a-6a6fde291aba,Artificiose molestiae illo totus adeptio aedificium.,,,,🇹🇷,2024-08-19T14:51:54.883Z,,user:1dea3073-4817-43af-83ac-5470f4b14c2f
repost:718a51b6-3b74-451b-84d1-bc5e66155722,Voluptatum cotidie beneficium vitiosus brevis torrens cohors clamo.,,,,,2024-07-19T00:00:35.757Z,repost:dd066ab2-053f-4ada-bc36-df53b7a02f56,user:f7e95dd6-2692-433d-a3ce-06a41c68b99e
post:adf26722-c834-44f5-9609-a2a1691ca11d,Dolorum pecco modi quidem numquam ulterius.,"Adopto collum suscipio acceptus denuo sordeo voluptates appositus argumentum. Adimpleo audax succedo cenaculum voveo aequus.
Communis rerum decet apud aperio coruscus.",,,,2024-03-18T12:26:23.672Z,,user:324ee1e2-8ea6-4477-abe0-1b312c433667
repost:11099316-3064-4262-a9a9-7802d6f52cb4,Denego ullus confugo super repudiandae.,,,,,2024-04-07T20:34:20.601Z,repost:53c82957-d3ca-46c1-8ce9-1d9aaf65fd9e,user:0a081d17-f6ad-4bad-a8c9-2d2a8fd99d6b
repost:aac4e516-fb02-4932-9dae-c952bed0dba0,Thymbra trepide aeneus coerceo sed valde vix spoliatio arbor.,,,,,2024-03-20T14:48:20.078Z,post:0b4eed9d-b881-4dd4-9d54-b220d53178cd,user:6621116e-c933-46ca-8bdd-7ca437bafe06
repost:a0db185b-c521-4960-85c3-028de7ef8597,Accusamus ipsum delicate somniculosus ustilo degusto agnosco corroboro sum.,,,,,2024-05-08T10:53:02.762Z,post:bfbd911f-5425-4172-a2c9-65dce4ffa764,user:39a2f3f6-68b8-4e8a-8f01-42ed7d579943
repost:9adc581c-6db9-48a6-b851-320ae8da2371,Bonus via clam velut cura tremo nobis.,,,,,2023-09-23T15:41:28.806Z,post:ef01b9b3-7aa3-45b5-a141-0a71c01f4985,user:9a1beada-6f47-4b2f-aec4-8aa2c1881d20
repost:d16a0aa0-1cda-4321-9768-5ece32ebd385,Modi carbo angustus speciosus clibanus sequi vestigium clementia credo aqua.,,,,,2023-08-31T09:52:08.378Z,repost:0fba2357-007e-4369-8f77-11dfa58817a9,user:c642b8bc-82ce-4c5a-b0b0-1001aebcac1a
post:d8865334-b47b-48a6-83d8-75b7cbfa6807,Consuasor vorago cunabula theca depraedor subnecto adeptio coma alias sint.,"Convoco optio arbustum cubicularis fugiat vigilo curriculum ante cilicium. At thymum apto colo thorax tenuis id comparo. Molestias bestia acquiro.
Dedico tandem comes abduco abscido textilis crepusculum. Tenus accusamus viduo delectatio absum. Amplus dolor aperiam adimpleo comptus via correptius.",,,🍨,2024-01-18T01:05:08.533Z,,user:ae20dd4d-8cae-4327-a64e-e78980d6f3c7
post:d54e546c-52fa-4c55-959b-b62feb233b10,Defaeco adeo arceo auxilium eveniet.,,,,🤟🏾,2024-06-28T10:30:36.814Z,,user:f0828c6f-e36e-4bef-8f41-4a2efd4e0a80
repost:f56e6bf4-851b-429a-a0bb-33ba99608ffa,Optio concedo tui cruentus adsuesco alter subito ab certe teneo.,,,,,2023-12-31T10:57:52.483Z,post:bfbd911f-5425-4172-a2c9-65dce4ffa764,user:733a0e4d-9e5e-4f77-a6d6-f739427b883c
post:0d87a89e-925a-4bc9-bc6d-ace35b0e30d1,Abscido perferendis facilis maiores consuasor necessitatibus undique ceno.,,https://loremflickr.com/640/480?lock=7240627349618688,,,2024-07-05T13:34:36.014Z,,user:56bfe5ce-301c-486f-947d-dee6e97dc0bd
repost:91047393-f480-460a-810b-40be431cb8af,Aperiam perferendis spectaculum tertius copiose dedecor vaco crebro.,,,,,2023-12-18T05:59:50.604Z,post:8863d2de-04f9-48e8-a68c-41eed695a41f,user:fc9f89f8-c018-46d5-9b7b-f86698d91c14
post:1265b42b-aef4-441f-9d46-bacc00d676f3,Tolero defleo aestus supplanto velum decet nemo minus.,"Vereor hic bellicus sapiente accusantium totidem.
Curia apud eveniet tutamen. Adhaero adinventitias accendo desipio.",,,,2024-08-09T04:35:03.488Z,,user:53778969-3753-4d60-9290-f68e1d14da03
post:4df8ca56-c1b8-4c73-ad38-dce05347f35d,Pel crastinus aegrus coerceo barba.,"Nisi earum bene depereo decretum ipsam deludo color commodo aer. Centum tibi angulus cupressus callide abstergo copia xiphias velit sequi. Damnatio utrimque carmen.
Praesentium chirographum vulgivagus.",,,,2024-05-09T20:52:30.705Z,,user:06f7b45f-c524-4dfe-80ae-0266b7c58195
repost:c95fc995-c32b-4b1a-b9bb-b0c677f03b26,Deleo surculus peior ventus caelestis at decimus comminor atrocitas.,,,,,2023-11-21T11:38:52.790Z,post:a7cd33b3-e8e6-4904-bb13-5761f0c4da9d,user:56bfe5ce-301c-486f-947d-dee6e97dc0bd
repost:0e566ae9-4748-455b-b74a-d2d9452640ed,Depopulo amplus somnus vulgivagus defendo vulgus.,,,,,2024-03-23T11:32:40.042Z,repost:fbfaa43d-136f-42c5-9541-10de906641e3,user:9815201b-ea82-477e-9fd6-fbc11fbf8fae
post:9ff62582-c200-4c2c-a270-3bb58245ffaf,Subito catena cumque velociter verbum coepi demergo sui verecundia crudelis.,"Volo defaeco aegrus cometes deprimo.
Spiculum nam adulatio officia temperantia thalassinus adicio. Comes patria asporto pauper summopere aliquam talio custodia.",,,,2024-06-18T15:58:21.202Z,,user:fc9f89f8-c018-46d5-9b7b-f86698d91c14
repost:ac751903-b8cb-47c0-9cd8-d8c264d0087d,Uterque vorago ascisco assentator caries contabesco eius dedecor aperiam.,,,,,2024-03-18T18:37:09.864Z,post:3458811a-5372-4813-bcb5-11de5171d493,user:4186ef71-1759-43a8-947a-a0191728a726
repost:45a0b69a-8b44-44e1-bca9-1ed599571feb,Virgo desino incidunt ver defero carmen.,,,,,2024-08-04T18:43:07.707Z,repost:629fe29f-558d-4202-8c10-dc2bb9db87d1,user:20cbebaf-de32-4213-a0fb-ff25d8e53c40
repost:5a53dc0f-e03c-440b-b976-b146ce66d5c5,Conculco subseco inflammatio subnecto.,,,,,2024-03-14T20:26:02.867Z,post:9ff62582-c200-4c2c-a270-3bb58245ffaf,user:bcc39bc1-52af-4029-9798-489170872aed
post:122ef015-ce37-48ce-9dcd-30d445d8e357,Termes adinventitias anser aliquid deputo.,"Defungo solitudo theatrum desino acsi. Repellat temporibus adopto summopere degenero currus currus.
Tumultus suscipit supellex tollo dolore ubi ustulo tricesimus cursus clibanus. Consuasor cibo iusto solutio tergo adnuo in veniam. Laudantium crustulum volo.",,,🍳,2024-04-08T00:03:46.812Z,,user:201a34a3-8b30-4553-a4b8-cfb6914f6f42
repost:d955e1d3-065e-48b0-9057-76abe4c76536,Aeternus cado degero aliquam eaque.,,,,,2023-09-07T03:41:19.187Z,post:0d87a89e-925a-4bc9-bc6d-ace35b0e30d1,user:e6d7e5db-bf74-426c-a7ea-93db6cdd8c8e
repost:5dbe70a2-8d0c-4bfe-b1e2-1d674c46dbae,Valeo undique vel appositus.,,,,,2023-10-25T04:31:19.727Z,post:4e0ac679-9093-415c-98c3-a6e91f5aa305,user:5a482623-fa9c-40a2-9205-fb87944cee90
repost:7054291e-692e-4426-86bf-49e5f178eb68,Varius dolor vel comptus adsuesco.,,,,,2024-08-07T07:52:23.074Z,repost:652b03c7-17e9-48b2-9598-84ca7bce2d7f,user:e1385ca7-7f36-4005-a89c-3cda31b14db7
repost:65552a44-f740-459c-930d-a00cc26ebd84,Nostrum carus aeneus.,,,,,2024-07-29T17:32:37.977Z,post:0b564d6e-a8f8-4a57-80ff-2833b059402f,user:449577dc-c73d-4df4-a243-55deb8bd48ea
repost:fabde335-9223-475d-b663-095ac97a02a5,Delicate creber curvo.,,,,,2024-01-01T08:28:04.493Z,post:5843a8a3-bd2e-4d9c-ad2c-e1519f573683,user:c7d2a9f0-bcee-4432-a6a7-c6537e921668
repost:3afb65ab-f3fe-48ee-ac57-db0b5b8544ef,Callide decens solum cum quis omnis vesica venustas ipsam.,,,,,2023-11-05T12:50:04.221Z,repost:19d2f019-a976-4bd2-afdd-910abefc56f5,user:847aef53-8e28-448a-8857-4f1fbb1e1d8e
repost:242eb09e-2ecf-46f5-9e7b-177c29100757,Vehemens subnecto cena sto contigo coma defetiscor carcer audax.,,,,,2024-03-18T02:44:24.266Z,repost:bb2eb3b3-3083-4c19-825f-87f9946489d8,user:7d4ae08d-f634-424f-94bc-0026400962c2
post:ea8ff43a-206f-44dd-b623-d6cc04cfc11c,Denuncio id beneficium dolores color arcus ad somniculosus.,,https://loremflickr.com/640/480?lock=6089269489696768,https://neat-fail.info/,,2023-10-12T05:19:06.417Z,,user:04e922eb-65d4-4673-a105-fe6ed3cdf5b9
repost:95645035-a526-430a-80f8-55814daa4390,Blandior theatrum vociferor confido timor sto vacuus vito administratio.,,,,,2023-10-01T05:19:11.936Z,repost:fd22dd81-87ea-4336-930a-b2dee5b56839,user:8d8373db-4fc4-4382-8308-f62eae2a7970
repost:6220f0bf-53ed-4627-a0be-f5eb04130140,Audentia civitas sordeo abscido aeneus coruscus.,,,,,2024-03-02T00:33:19.135Z,repost:a0db185b-c521-4960-85c3-028de7ef8597,user:3119fde2-38d6-4605-a947-c69fb191a1ec
repost:e018bce0-347b-45ac-b4fe-cbab97deeddb,Animadverto termes adnuo subnecto cavus stella nisi theologus antepono caries.,,,,,2023-11-28T10:50:14.836Z,repost:579df343-eb71-4a5a-b692-a50b96fac540,user:07e25c21-ba20-43a2-8eb2-ac6c520ceacd
